URL,Title,Selection,Folder,Timestamp
http://www.wsj.com/articles/reaction-to-at-t-time-warner-deal-shows-presidencys-growing-reach-1477501112,Reaction to AT&T-Time Warner Deal Shows Presidency’s Growing Reach,AT&T-Time Warner Reaction Shows Presidency’s Growing Reach,Archive,1477518856
http://www.wsj.com/articles/tech-ipos-to-surge-next-year-investment-banker-says-1477503007,"Tech IPOs to Surge Next Year, Investment Banker Says","Tech IPOs to Surge Next Year, Investment Banker Says",Archive,1477518824
http://www.wsj.com/articles/palantir-ceo-says-company-is-being-positioned-to-go-public-1477498155,Palantir CEO Says Data-Mining Company is Positioned to Go Public,Palantir CEO Says Firm Being Positioned to Go Public,Archive,1477518821
http://www.wsj.com/articles/verizon-executive-says-yahoo-deal-absolutely-still-makes-sense-1477501747,Verizon Executive Says Yahoo Deal ‘Absolutely’ Still Makes Sense,Verizon Executive: Yahoo Deal Still Makes Sense,Archive,1477518818
http://www.wsj.com/articles/ibm-a-billion-people-to-use-watson-by-2018-1477496455,IBM: A Billion People to Use Watson by 2018,IBM: A Billion People to Use Watson by 2018,Archive,1477518812
http://www.wsj.com/articles/tesla-posts-second-profitable-quarter-ever-1477513454,Tesla Posts Second Profitable Quarter Ever,Tesla Shares Jump After Posting Best Quarterly Sales Ever,Archive,1477518794
http://ben-evans.com/benedictevans/2016/4/20/the-best-is-the-last,The best is the last,,Archive,1477515779
http://www.wsj.com/articles/voters-face-hot-button-issues-on-state-ballots-1477510659,Voters Face Hot-Button Issues on State Ballots,,Archive,1477512154
http://www.wsj.com/articles/airbus-boeing-chase-follow-own-paths-to-further-growth-1477509564,"Airbus, Boeing Follow Own Paths to Further Growth",,Archive,1477512147
http://www.wsj.com/articles/bitter-presidential-race-breeds-workplace-tensions-1477510115,Bitter Presidential Race Breeds Workplace Tensions,,Archive,1477512113
http://www.nytimes.com/2016/10/27/health/hiv-patient-zero-genetic-analysis.html,H.I.V. Arrived in the U.S. Long Before ‘Patient Zero’,,Archive,1477511886
https://www.bloomberg.com/news/articles/2016-10-26/google-s-alphabet-experiment-misses-key-goal-keeping-executives,Google’s Alphabet Experiment Misses Goal: Keeping Executives,,Archive,1477508244
http://www.nytimes.com/2016/10/26/technology/self-driving-trucks-first-mission-a-beer-run.html,Self-Driving Truck’s First Mission: A Beer Run,,Archive,1477486947
https://medium.com/@benhuh/should-i-pursue-my-passion-or-business-76187b6b83fb,Should I Pursue My Passion or Business?,,Archive,1477486925
http://fortune.com/2016/10/24/trump-clinton-silicon-valley/,What the U.S. Elections Mean For Silicon Valley,,Archive,1477451406
https://medium.com/the-year-of-the-looking-glass/what-do-i-do-at-work-all-day-9119af6bc501,What Do I Do At Work All Day,What Do I Do At Work All Day? http://ift.tt/2dG2aj9,A year of the looking glass,1477421467
http://www.nytimes.com/2016/10/25/us/politics/hillary-clinton-elizabeth-warren.html,Liberals Hope Elizabeth Warren Will Serve as Clinton’s Scrutinizer-in-Chief,,Archive,1477361537
http://www.nytimes.com/2016/10/25/us/some-health-plan-costs-to-increase-by-an-average-of-25-percent-us-says.html,"Some Health Plan Costs to Increase by an Average of 25 Percent, U.S. Says",,Archive,1477361535
http://www.nytimes.com/2016/10/25/nyregion/justice-dept-replaces-investigators-on-eric-garner-case.html,Justice Dept. Replaces Investigators on Eric Garner Case,,Archive,1477361533
http://www.wsj.com/articles/at-ts-deal-for-time-warner-faces-tough-climate-1477349309,AT&T’s Deal for Time Warner Faces Tough Climate,,Archive,1477361531
http://www.wsj.com/articles/the-new-corporate-power-brokers-passive-investors-1477320101,Meet the New Corporate Power Brokers: Passive Investors,,Archive,1477361528
http://www.wsj.com/articles/td-ameritrade-to-acquire-scottrade-1477303931,TD Ameritrade to Acquire Scottrade Financial,,Archive,1477361527
http://www.wsj.com/articles/feds-task-next-week-signal-december-rate-rise-1477351253,Fed’s Task Next Week: Signal December Rate Rise,,Archive,1477361525
http://blogs.wsj.com/moneybeat/2016/10/24/berkshire-portfolio-manager-explains-apple-investment/,Berkshire Portfolio Manager Explains Apple Investment,,Archive,1477361524
http://www.wsj.com/articles/auto-makers-struggle-with-high-tech-dashboard-screens-1477301406,Auto Makers Struggle With High-Tech Dashboard Screens,,Archive,1477361522
http://www.wsj.com/articles/apple-gets-polished-ahead-of-results-1477333228,Apple Gets Polished Ahead of Results,,Archive,1477361521
http://www.wsj.com/articles/netsuite-could-sour-if-oracle-bid-is-lost-1477336803,NetSuite Could Sour If Oracle Bid Is Lost,,Archive,1477361519
http://www.wsj.com/articles/chinas-aggressive-new-deal-makers-199-billion-this-year-and-counting-1477348851,China’s Aggressive New Deal Makers: $199 Billion This Year and Counting,,Archive,1477361518
http://www.wsj.com/articles/americans-respect-for-police-reaches-highest-level-since-1967-poll-finds-1477344780,"Americans’ Respect for Police Reaches Highest Level Since 1967, Poll Finds",,Archive,1477361516
http://www.wsj.com/articles/russia-revives-nuclear-shelters-as-cold-war-heats-up-1477301408,Russians Conduct Nuclear-Bomb Survival Drills as Cold War Heats Up,,Archive,1477361515
http://www.wsj.com/articles/belgium-wont-support-trade-deal-with-canada-1477316497,"EU, Canada Trade Deal Blocked by Belgian Opposition",,Archive,1477361512
http://www.wsj.com/articles/visa-profit-rises-28-as-results-top-wall-street-views-1477340874,Visa Profit Rises 28% as Results Top Wall Street Views,,Archive,1477361510
https://www.washingtonpost.com/news/wonk/wp/2014/10/18/poor-kids-who-do-everything-right-dont-do-better-than-rich-kids-who-do-everything-wrong/,Poor kids who do everything right don’t do better than rich kids who do everything wrong,,Archive,1477359609
http://www.economist.com/news/business/21709061-entrepreneurs-finances-are-jaw-dropping-inventive-and-combustible-his-space,Countdown,,Archive,1477359517
http://www.economist.com/news/middle-east-and-africa/21709203-defeat-jihadist-group-real-world-might-revive-realism-among,Islamic State’s messianic apocalypse is postponed,,Archive,1477359515
http://www.economist.com/news/business-and-finance/21709150-combination-huge-distributor-tv-leading-content-producer-bold,AT&T and Time Warner plot a blockbuster media future,,Archive,1477359512
http://www.economist.com/news/leaders/21709023-right-way-capture-jihadists-most-important-stronghold-crushing-caliphate,Crushing the caliphate,,Archive,1477359509
https://www.bloomberg.com/features/year-ahead-2017/,50 Companies to Watch in 2017,,Archive,1477359497
https://www.bloomberg.com/view/articles/2016-10-24/kansas-ends-bad-economic-news-by-not-reporting-it,Kansas Ends Bad Economic News by Not Reporting It,,Archive,1477359495
http://www.bloomberg.com/politics/articles/2016-10-24/at-t-chief-who-favors-republicans-may-need-democrats-to-win-deal,AT&T Chief Who Favors Republicans May Need Democrats to Win Deal,,Archive,1477359492
http://www.bloomberg.com/news/articles/2016-10-24/bond-buyers-binge-on-netflix-to-fund-the-next-stranger-things,Bond Buyers Binge on Netflix to Fund the Next ‘Stranger Things’,,Archive,1477359468
http://www.bloomberg.com/news/articles/2016-10-24/asia-stocks-point-to-mixed-open-dollar-hovers-near-7-month-high,Asian Stocks Advance Amid Earnings as Dollar Gains; Oil Steady,,Archive,1477359466
https://www.bloomberg.com/news/articles/2016-10-25/twitter-said-to-plan-hundreds-more-job-cuts-as-soon-as-this-week,Twitter Planning Hundreds More Job Cuts as Soon as This Week,,Archive,1477359463
https://www.bloomberg.com/news/articles/2016-10-24/peter-thiel-s-politics-become-a-deal-killer-in-silicon-valley,Peter Thiel’s Politics Become a Deal-Killer in Silicon Valley,,Archive,1477359460
https://www.bloomberg.com/news/articles/2016-10-21/watch-out-wal-mart-amazon-is-coming-after-the-grocery-business,Watch Out Wal-Mart. Amazon Is Coming After the Grocery Business,Goldman Runs Ads on Spotify to Recruit Young Employees,Archive,1477176250
https://www.bloomberg.com/news/articles/2016-10-21/goldman-sachs-advertises-on-spotify-to-recruit-young-employees,Goldman Sachs Advertises on Spotify to Attract Young Employees,Goldman Runs Ads on Spotify to Recruit Young Employees,Archive,1477176243
http://www.bloomberg.com/news/articles/2016-10-20/warren-buffett-loves-this-business-maybe-a-little-too-much,Warren Buffett Loves This Business—Maybe a Little Too Much,Warren Buffett Loves This Business—Maybe a Little Too Much,Archive,1477176232
https://www.bloomberg.com/graphics/2016-obamacare/,Why 27 Million Are Still Uninsured Under Obamacare,Why 27 Million Are Still Uninsured Under Obamacare,Archive,1477176222
http://www.bloomberg.com/news/articles/2016-10-18/the-scientist-who-cracked-iran-has-a-plan-for-climate-change,The Scientist Who Cracked Iran Has a Plan for Climate Change,The Scientist Who Cracked Iran Has a Plan for Climate Change,Archive,1477176208
https://www.bloomberg.com/news/articles/2016-10-22/connected-gadgets-blamed-as-internet-recovers-from-friday-attack,Connected Gadgets Blamed as Internet Recovers From Friday Attack,Connected Gadgets Blamed For Friday Internet Attack,Archive,1477176201
http://www.bloomberg.com/news/articles/2016-10-20/it-s-better-to-buy-than-to-rent-and-it-probably-always-will-be,"It's Better to Buy Than to Rent, and It Probably Always Will Be","It's Better to Buy Than to Rent, and It Probably Always Will Be",Archive,1477176195
http://www.nytimes.com/2016/10/23/us/fbi-women.html,Missing Persons Case: Where Are Women in F.B.I.’s Top Ranks?,"Where Are Women in 
F.B.I.’s Top Ranks?",Archive,1477176183
http://www.nytimes.com/interactive/2016/10/22/world/americas/canada-refugees-syria.html,They Took In One Refugee Family. But Families Don’t Have Borders.,They Took In One Refugee Family. But Families Don’t Have Borders.,Archive,1477176170
http://www.economist.com/blogs/freeexchange/2016/10/pain-threshold,China’s uncannily stable growth versus the price of reform,,Archive,1477359506
http://www.economist.com/news/science-and-technology/21708996-well-neither-actually-triumph-or-disaster,Triumph or disaster?,,Archive,1477359503
http://www.economist.com/news/asia/21708984-philippines-until-now-staunch-american-ally-falling-chinese-camp-dutertes-pivot,Duterte’s pivot,"Rodrigo Duterte’s impetuous pivot
Is the Philippines, until now a staunch American ally, falling into the Chinese camp? 212",Archive,1477176148
http://www.economist.com/news/europe/21709140-julys-coup-war-between-government-and-pkk-has-grown-more-bitter-turkeys-kurds,Turkey’s Kurds are caught between an insurgency and a crackdown,"Turkey’s Kurds are caught between an insurgency and a crackdown
Since July’s coup, the war between the government and the PKK has grown more bitter 25",Archive,1477176146
http://www.economist.com/news/united-states/21709053-americas-probable-next-president-deeply-reviled-why-hating-hillary,Hating Hillary,"Tears over the collapse of the EU-Canada trade deal
The grumpy, insular mood of the European Union 29",Archive,1477176137
http://www.economist.com/news/europe/21709145-grumpy-insular-mood-european-union,Tears over the collapse of the EU-Canada trade deal,"Tears over the collapse of the EU-Canada trade deal
The grumpy, insular mood of the European Union 29",Archive,1477176134
http://www.economist.com/news/international/21709019-flow-africans-libya-italy-now-europes-worst-migration-crisis-travelling,Travelling in hope,"Travelling in hope
Migration to Europe",Archive,1477176128
http://www.economist.com/news/middle-east-and-africa/21709147-kurdish-and-iraqi-troops-are-bogged-down-heavy-fighting-they-squeeze-islamic,On Mosul’s front line: “These car bombs are the Islamic State’s version of air strikes.”,"The crumbling caliphate
On Mosul’s front line",Archive,1477176125
http://www.economist.com/news/special-report/21708879-when-soviet-union-collapsed-25-years-ago-russia-looked-set-become-free-market,Inside the bear,,Archive,1477176122
http://www.wsj.com/articles/moodys-says-justice-department-is-preparing-a-complaint-1477056302,Moody’s Expects U.S. to Sue Over Its Pre-Crisis Bond Ratings,Moody’s Expects U.S. to Sue Over Its Precrisis Ratings,Archive,1477176085
http://www.wsj.com/articles/energy-producers-edge-closer-to-tapping-drilled-but-uncompleted-wells-1477139848,Energy Producers Edge Closer to Tapping ‘Drilled but Uncompleted’ Wells,Energy Firms Get Closer to Tapping ‘Drilled but Uncompleted’ Wells,Archive,1477176066
http://www.wsj.com/articles/behind-philippine-leaders-break-with-the-u-s-a-lifetime-of-resentment-1477061118,"Behind Duterte’s Break With the U.S., a Lifetime of Resentment","Behind Duterte Break With U.S., a Lifetime of Resentment",Archive,1477176038
http://www.wsj.com/articles/airline-suspends-venezuela-flights-after-plane-is-tracked-1477165809,Airline Suspends Venezuela Flights After Plane Is Tracked,Airline Suspends Venezuela Flights After Plane Is Tracked,Archive,1477176035
http://www.wsj.com/articles/facebook-employees-pushed-to-remove-trump-posts-as-hate-speech-1477075392,Facebook Employees Pushed to Remove Trump’s Posts as Hate Speech,Some at Facebook Pushed for Removal of Trump’s Posts,Archive,1477176031
http://www.wsj.com/articles/judge-to-rule-on-sentence-for-former-pennsylvania-attorney-general-kathleen-kane-1477134002,Judge to Rule on Sentence for Former Pennsylvania Attorney General Kathleen Kane,Judge to Rule on Sentence for Former Pennsylvania Attorney General Kathleen Kane,Archive,1477176031
http://www.wsj.com/articles/can-pricey-shoes-boost-a-mans-ego-1476992112,Can Pricey Shoes Boost a Man’s Ego?,Can Pricey Shoes Boost a Man’s Ego?,Archive,1477176021
http://www.wsj.com/articles/turns-out-counting-on-your-fingers-makes-you-smarter-1477065563,"Turns Out, Counting on Your Fingers Makes You Smarter","Turns Out, Counting on Your Fingers Makes You Smarter",Archive,1477176012
http://www.wsj.com/articles/at-t-verizon-make-differing-bets-as-wireless-growth-stalls-1477159766,"AT&T, Verizon Make Differing Bets as Wireless Growth Stalls","AT&T, Rival Verizon Make Differing Bets as Wireless Growth Stalls",Archive,1477176009
http://www.wsj.com/articles/ash-carter-visits-iraq-for-meetings-on-mosul-offensive-1477123003,Iraq’s Abadi Rejects Turkish Assistance in Mosul Offensive,Iraq Rejects Turkish Assistance in Mosul Offensive,Archive,1477176007
http://www.wsj.com/articles/at-t-reaches-deal-to-buy-time-warner-for-more-than-80-billion-1477157084,AT&T Reaches Deal to Buy Time Warner for More Than $80 Billion,AT&T Turns Into Media Giant With Time Warner Deal,Archive,1477176002
http://www.wsj.com/articles/a-new-real-estate-war-in-silicon-valley-1476829387,A New Real-Estate War in Silicon Valley,,Archive,1477436877
http://www.bloomberg.com/news/articles/2016-09-22/the-professor-who-was-right-about-index-funds-all-along,The Professor Who Was Right About Index Funds All Along,A Professor Who Was Right About Index Funds All Along,Archive,1477175953
http://tombh.co.uk/when-your-screen-breaks-in-the-himalayas,tom bh,When Your Screen Breaks in the Himalayas,Archive,1477175947
http://www.nytimes.com/2016/10/20/technology/how-silicon-valley-treats-a-trump-backer-peter-thiel.html,How Silicon Valley Treats a Trump Backer: Peter Thiel,How Silicon Valley Treats a Trump Backer: Peter Thiel,Archive,1477175932
http://twinprime.com/lte-has-slowed-by-50-in-the-us/,#MobilePerf Insights: Why LTE Has Slowed by 50% in the US This Year,LTE Has Slowed by 50% in the US This Year,Archive,1477175928
https://www.tesla.com/blog/all-tesla-cars-being-produced-now-have-full-self-driving-hardware,All Tesla Cars Being Produced Now Have Full Self-Driving Hardware,All Tesla Cars Being Produced Now Have Full Self-Driving Hardware,Archive,1477175920
http://www.wsj.com/articles/spacex-probe-into-blast-focuses-on-fueling-issues-1477042203,SpaceX Explosion Investigation Focuses on Fueling Snafu,,Archive,1477169372
http://www.wsj.com/articles/denial-of-service-web-attack-affects-amazon-twitter-others-1477056080,Cyberattack Knocks Out Access to Websites,Attacks Rattle the Internet,Archive,1477176060
http://www.wsj.com/articles/iraqi-troops-stoke-sectarian-tensions-in-mosul-fight-1477042201,Iraqi Troops Stoke Sectarian Tensions in Mosul Fight,,Archive,1477169368
http://blogs.wsj.com/moneybeat/2016/10/21/the-108-billion-man-who-has-beaten-the-market/,The $108 Billion Man Who Has Beaten the Market,The $108 Billion Man Who Beat the Market,Archive,1477176071
http://www.wsj.com/articles/boe-official-bank-legal-costs-since-2008-reach-275-billion-1476974749,Bank Legal Costs Cited as Drag on Economic Growth,,Archive,1477169364
http://www.wsj.com/articles/xi-jinpings-trump-moment-1477056486,Xi Jinping’s Trump Moment,,Archive,1477169362
http://www.wsj.com/articles/rising-insurance-premiums-spurs-talk-of-changes-to-affordable-care-act-1477062006,Rising Insurance Premiums Spurs Talk of Changes to Affordable Care Act,,Archive,1477169359
http://www.wsj.com/articles/militants-attack-police-compound-in-northern-iraqs-kirkuk-1477029689,Islamic State Launches Kirkuk Attacks While Focus Is on Mosul,,Archive,1477169357
http://www.wsj.com/articles/microsoft-shares-hit-all-time-high-1477057103,Microsoft Shares Hit All-Time High,,Archive,1477169355
http://www.wsj.com/articles/mcdonalds-earnings-top-expectations-1477052679,McDonald’s Earnings Top Expectations,,Archive,1477169354
http://www.wsj.com/articles/ge-profit-falls-as-revenue-growth-less-than-expected-1477047596,GE Profit Falls as Revenue Growth Less Than Expected,,Archive,1477169352
https://marco.org/2016/10/17/shame-on-y-combinator,Shame on Y Combinator,,Archive,1477081514
http://www.newyorker.com/business/currency/apple-samsung-and-good-design-inside-and-out,"Apple, Samsung, and Good Design—Inside and Out",,Archive,1477081509
http://www.nytimes.com/2016/10/06/technology/mailchimp-and-the-un-silicon-valley-way-to-make-it-as-a-start-up.html,MailChimp and the Un-Silicon Valley Way to Make It as a Start-Up,,Archive,1477081475
http://blog.samaltman.com/the-2016-election,The 2016 Election,The 2016 Election http://ift.tt/2e29sUT,Sam Altman,1476733458
https://medium.com/the-year-of-the-looking-glass/the-sanctity-of-your-calendar-f96415b6f3ea,The Sanctity of Your Calendar in The Year of the Looking Glass,"""The Sanctity of Your Calendar"" in The Year of the Looking Glass http://ift.tt/2dO1rxz",A year of the looking glass,1475786362
https://medium.com/@kpcb_edge/enabling-analysis-of-private-data-a6229c7d72bb,Enabling Analysis of Private Data,Having your cake and eating it too—training AI on private data https://t.co/bpIc7KeVbj,Archive,1475770454
https://www.reddit.com/r/UMD/comments/55ice5/can_not_decide_on_major/,can not decide on major • /r/UMD,,Archive,1475462925
http://blog.samaltman.com/1-dollars-million-voteplz-sweepstakes,$1 Million VotePlz Sweepstakes,$1 Million VotePlz Sweepstakes http://ift.tt/2cwGWne,Sam Altman,1474910752
https://medium.com/the-year-of-the-looking-glass/letter-to-my-newborn-son-833491540844,Letter To My Newborn Son in The Year of the Looking Glass,"""Letter To My Newborn Son"" in The Year of the Looking Glass http://ift.tt/2cWb5yI",A year of the looking glass,1474615498
https://www.icloud.com/,iCloud - Find My Friends,,Archive,1472951399
http://blog.samaltman.com/dont-read-the-comments,Don't Read The Comments,Don't Read The Comments http://ift.tt/2bzZs2O,Sam Altman,1471986513
https://medium.com/@joulee/what-you-see-is-what-you-use-5a97677a8c71,What You See is What You Use,What You See is What You Use http://ift.tt/2bxDywB,A year of the looking glass,1471365148
https://www.reddit.com/r/Fitness/comments/4w9osa/foolish_friday_your_biweekly_stupid_questions/,Foolish Friday - Your biweekly stupid questions thread,,Archive,1470432554
https://www.youtube.com/,pixar - YouTube,,Archive,1497180051
https://medium.com/@joulee/how-to-think-about-your-career-abf5300eba08,How to Think About Your Career,How to Think About Your Career http://ift.tt/2abipTP,Archive,1470125307
http://www.nytimes.com/2016/07/10/opinion/sunday/how-wall-street-bro-talk-keeps-women-down.html,How Wall Street Bro Talk Keeps Women Down,"Should be required reading in every Business School via @SamPolk ""How Wall Street Bro Talk Keeps Women Down"" https://t.co/BVPIOJjqjX",Archive,1467948856
https://medium.com/@joulee/metrics-versus-experience-a9347d6b80b,Metrics Versus Experience,Metrics Versus Experience http://ift.tt/29i6401,A year of the looking glass,1467826894
http://www.nytimes.com/2016/06/26/business/tenure-extension-policies-that-put-women-at-a-disadvantage.html?nytmobile=0,A Family-Friendly Policy That’s Friendliest to Male Professors - NYTimes.com,"One more example that treating women and men ""the same"" usually benefits men at women's expense: https://t.co/3S3VO0eRdB",Archive,1467566501
http://fivethirtyeight.com/features/how-many-republicans-marry-democrats/,How Many Republicans Marry Democrats?,How many Republicans marry Democrats? https://t.co/7erVjUDBWH https://t.co/TZe8nMqoS3,Archive,1467156322
http://fivethirtyeight.com/features/we-study-what-makes-people-more-liberal-but-what-makes-them-more-conservative/,We Study What Makes People More Liberal. But What Makes Them More Conservative?,We study what makes people more liberal. But what makes them more conservative? https://t.co/XDyEwRSNXq https://t.co/C26qZLtPFZ,Archive,1467150285
https://www.washingtonpost.com/business/economy/meet-the-new-chief-of-staff/2016/06/24/c82b614c-3348-11e6-95c0-2a6873031302_story.html,Meet the new chief of staff — to tech’s biggest power players,Meet the private club for Silicon Valley billionaires' right hand men and women.  https://t.co/9TRqUQiHKu,Archive,1467087254
http://blog.samaltman.com/trump,Trump,Trump http://ift.tt/28K39SE,Sam Altman,1466451667
http://fivethirtyeight.com/features/kitchen-table-politics-the-cost-of-caring-for-kids/,Kitchen Table Politics: The Cost Of Caring For Kids,🎧 The cost of caring for kids: https://t.co/QF3UDUAOya https://t.co/7IRUvpUAKM,Archive,1466119326
http://www.wsj.com/articles/the-mystery-of-jewish-and-asian-american-democratic-loyalty-1465943377,The Mystery of Jewish and Asian-American Democratic Loyalty,"It's not GOP racism -- it's those liberal professors!

The mystery of Jewish and Asian-American Democratic loyalty https://t.co/am0uVjS45V",Archive,1466000173
http://blog.samaltman.com/were-in-a-bubble,'We're in a Bubble','We're in a Bubble' http://ift.tt/1ZPxhLw,Sam Altman,1465958565
http://www.economist.com/news/united-states/21699914-democratic-challenger-thinks-he-still-has-shot-nomination-hes,"California, here we come",.@BernieSanders's refusal to admit defeat is hurting @hillaryclinton - my piece https://t.co/kgxddmVRJX via @TheEconomist,Archive,1464967170
https://medium.com/the-year-of-the-looking-glass/building-products-91aa93bea4bb,Building Products in The Year of the Looking Glass,"""Building Products"" in The Year of the Looking Glass http://ift.tt/22AlAdl",A year of the looking glass,1464890058
http://www.nytimes.com/2016/05/29/opinion/sunday/why-you-will-marry-the-wrong-person.html?nytmobile=0,Why You Will Marry the Wrong Person - NYTimes.com,Why You Will Marry the Wrong Person https://t.co/Md1d9NNctD,Archive,1464617484
http://blog.samaltman.com/housing-in-the-bay-area,Housing in the Bay Area,Housing in the Bay Area http://ift.tt/1Wknijh,Sam Altman,1464224766
http://www.wsj.com/articles/an-insiders-guide-to-san-francisco-1464116611,An Insider’s Guide to San Francisco,An insider’s guide to San Francisco https://t.co/BySzU6c3ZD,Archive,1464148408
http://www.theatlantic.com/business/archive/2016/04/why-so-many-smart-people-arent-happy/479832/,Why So Many Smart People Aren’t Happy,,Archive,1464038228
https://www.propublica.org/article/machine-bias-risk-assessments-in-criminal-sentencing,Machine Bias: There’s Software Used Across the Country to Predict Future Criminals. And it’s Biased Against Blacks.,,Archive,1464015961
http://fivethirtyeight.com/features/the-best-jobs-now-require-you-to-be-a-people-person/,The Best Jobs Now Require You To Be A People Person,,Archive,1463879607
http://www.theatlantic.com/politics/archive/2014/01/the-agony-of-frank-luntz/282766/,The Agony of Frank Luntz,,Archive,1463879220
http://www.nytimes.com/2016/05/20/technology/oracle-google-dispute-goes-to-heart-of-open-source-software.html,Oracle-Google Dispute Goes to Heart of Open-Source Software,,Archive,1463877208
https://medium.com/the-year-of-the-looking-glass/ten-years-b82232c4cc68,Ten Years in The Year of the Looking Glass,"""Ten Years"" in The Year of the Looking Glass http://ift.tt/21PuFyL",A year of the looking glass,1462821563
http://www.newyorker.com/magazine/2009/10/26/man-of-extremes,Man of Extremes,,Archive,1462768129
https://medium.com/the-year-of-the-looking-glass/design-illustrated-in-3-charts-128ae8ff22fe,"Design, Illustrated in 3 Charts in The Year of the Looking Glass","""Design, Illustrated in 3 Charts"" in The Year of the Looking Glass http://ift.tt/23sa2HX",A year of the looking glass,1462464891
https://www.google.com/search?client=safari&ie=UTF-8&oe=UTF-8&q=umd+size&rls=en,lmu notable alumni - Google Search,,Archive,1462215247
https://medium.com/the-year-of-the-looking-glass/unintuitive-things-i-ve-learned-about-management-part-2-7c22fc9d87ed,Unintuitive Things I’ve Learned about Management (Part 2) in The Year of the Looking Glass,"""Unintuitive Things I’ve Learned about Management (Part 2)"" in The Year of the Looking Glass http://ift.tt/1SDzggy",A year of the looking glass,1460655504
http://blog.samaltman.com/cruise,Cruise,Cruise http://ift.tt/1Muokpr,Sam Altman,1460571527
