URL,Title,Selection,Folder,Timestamp
https://write.as/formerly-known-as-a-philosopher/confession-of-an-ex-philosopher,Confessions of an Ex Philosopher,,Unread,1581651696
http://www.foundersatwork.com/steve-wozniak.html,Steve Wozniak,"If any one person can be said to have set off the personal computer revolution, it might be Steve Wozniak. He designed the machine that crystallized what a desktop computer was: the Apple II.",Unread,1581647893
https://medium.com/@nic__carter/lessons-from-the-uneven-distribution-of-capital-ce665def00e6,Lessons from the uneven distribution of capital,,Unread,1581228448
https://nakamoto.com/it-will-take-years-for-smart-people-to-understand-cryptocurrencies/,It Will Take Years for Smart People to Understand Cryptocurrencies,,Archive,1580769417
https://stripe.com/gb/atlas/guides/starting-sales,Stripe Atlas: Guide to getting your first 10 customers,,Unread,1580587349
https://www.inputmag.com/tech/the-ipads-original-software-designer-and-program-lead-look-back-on-the-devices-first-10-years,The iPad's original software designer and program lead look back on the device's first 10 years,,Unread,1580504744
https://putanumonit.com/2020/01/26/skewed-and-the-screwed/,The Skewed and the Screwed: When Mating Meets Politics,,Unread,1580490455
http://www.paulgraham.com/noob.html,Being a Noob,Being a Noob https://ift.tt/2RDp2qA,To Read,1580379745
https://t.co/Qm26iF6Ocf?amp=1&ssr=true,"The Truth About ""Dramatic Action""",,Archive,1580222099
https://www.wired.com/story/apple-ipad-turns-10/,The iPad Turns 10: A Look Back at Its First Decade,,Archive,1580144532
https://alexdanco.com/2020/01/23/social-capital-in-silicon-valley/,Social Capital in Silicon Valley,,Archive,1580131356
https://thehustle.co/the-economics-of-all-you-can-eat-buffets/,The economics of all-you-can-eat buffets,,Archive,1580048487
https://www.revolvermag.com/music/nine-inch-nails-9-things-we-learned-our-visit-trent-reznors-studio,Nine Inch Nails: 9 Things We Learned From Our Visit to Trent Reznor's Studio,,Archive,1580039229
https://exponents.substack.com/p/antitrust-for-thee-profits-for-me,"Antitrust for thee, profits for me",,Unread,1579972165
http://www.espn.com/espn/feature/story/_/id/13035450/league-legends-prodigy-faker-carries-country-shoulders,From The Mag: The Unkillable Demon King,,Unread,1579796443
https://www.theblockcrypto.com/post/12955/so-is-binance-coin-actually-worth-anything,"So, is Binance Coin actually worth anything? - The Block",,Archive,1579625676
https://www.ribbonfarm.com/2020/01/16/the-internet-of-beefs/,The Internet of Beefs,,Unread,1579572019
https://meditationstuff.wordpress.com/2020/01/20/meditation-is-not-strength-training/,meditation is not strength-training,,Archive,1579538961
https://www.foreignaffairs.com/articles/united-states/2019-12-10/clash-capitalisms,The Clash of Capitalisms,,Archive,1579453698
https://medium.com/@simon.sarris/designing-a-new-old-home-part-1-cf298b58ed41,Designing a New Old Home: Part 1,,Unread,1579396292
https://www.nytimes.com/2020/01/18/technology/clearview-privacy-facial-recognition.html,The Secretive Company That Might End Privacy as We Know It,,Archive,1579377236
https://medium.com/@NaithanJones/inclusion-is-not-for-outsiders-3c0cda739b09,“Inclusion” is not for outsiders,,Archive,1579295917
http://www.sanctionthebook.com/the-books-of-sanction-i-the-black-swan,"The Books of Sanction I - The Black Swan, Nassim Nicholas Taleb",,Archive,1579295848
https://www.tes.com/magazine/article/real-case-independent-schools,The real case for independent schools,,Archive,1579140560
https://www.bloomberg.com/news/articles/2020-01-14/wall-street-s-biggest-bond-trading-desks-end-2019-with-a-roar,Wall Street’s Biggest Bond Trading Desks End 2019 With a Roar,,Archive,1579026895
http://paulgraham.com/fh.html,Haters,,Archive,1578943605
https://www.bloomberg.com/news/articles/2020-01-13/behavioral-economics-latest-bias-seeing-bias-wherever-it-looks,Behavioral Economics’ Latest Bias: Seeing Bias Wherever It Looks,,Archive,1578943160
https://blog.samaltman.com/how-to-invest-in-startups,How To Invest In Startups,How To Invest In Startups https://ift.tt/30iCjI3,To Read,1578935004
http://johnsalvatier.org/blog/2017/reality-has-a-surprising-amount-of-detail,Reality has a surprising amount of detail,,Archive,1578783345
http://www.paulgraham.com/fh.html,Haters,Haters https://ift.tt/30a9wFq,To Read,1578738386
https://themargins.substack.com/p/facebooks-pr-feels-broken,Facebook's PR feels broken,,Archive,1578718087
https://marginalrevolution.com/marginalrevolution/2020/01/how-is-twitter-disrupting-academia.html,How is Twitter disrupting academia? - Marginal REVOLUTION,,Archive,1578587044
https://medium.com/@nic__carter/an-introduction-to-the-efficient-market-hypothesis-for-bitcoiners-ed7e90be7c0d,An Introduction to the Efficient Market Hypothesis for Bitcoiners,,Archive,1578162565
https://nakamoto.com/bitcoin-becomes-the-flag-of-technology/,Bitcoin becomes the Flag of Technology,,Archive,1578130370
https://timesofindia.indiatimes.com/india/every-year-govt-to-roll-out-one-n-reactor-dae/articleshow/73052764.cms,"Every year, govt to roll out one N-reactor: DAE - Times of India",,Archive,1577979903
https://avc.com/2020/01/what-will-happen-in-the-2020s/,What Will Happen In The 2020s – AVC,,Archive,1577979165
https://gen.medium.com/my-semester-with-the-snowflakes-888285f0e662,My Semester With the Snowflakes,,Archive,1577705224
https://www.theamericanconservative.com/articles/corporatism-is-an-american-bipartisan-scourge/,"Corporatism is an American, Bipartisan Scourge | The American Conservative",,Archive,1577646919
http://www.paulgraham.com/mod.html,The Two Kinds of Moderate,The Two Kinds of Moderate https://ift.tt/2ZpWMKD,To Read,1577441780
https://americanmind.org/features/the-death-of-virtue-and-the-rise-of-expertise/losing-the-souls/,Losing the Souls,,Archive,1577433459
https://medium.com/@efeng/seed-investors-are-favoring-enterprise-startups-and-other-conclusions-from-analyzing-y-110432adf199,"Seed investors are favoring enterprise startups, and other conclusions from analyzing Y…",,Archive,1577425624
https://twitter.com/ryanholiday/status/1210216739138670592,Twitter,,Archive,1577373998
https://louisproyect.org/2015/08/28/steve-jobs/,Steve Jobs,,Archive,1577341481
https://m.signalvnoise.com/fuck-hard-work/,Fuck hard work,,Archive,1577338635
https://www.wsj.com/articles/state-support-helped-fuel-huaweis-global-rise-11577280736,WSJ News Exclusive | State Support Helped Fuel Huawei’s Global Rise,,Archive,1577288399
http://theviewfromhell.blogspot.com/2012/11/fungibility-and-loss-of-demandingness.html,Fungibility and the Loss of Demandingness,,Archive,1577190905
http://www.paulgraham.com/fp.html,Fashionable Problems,Fashionable Problems https://ift.tt/2PN0ZEP,To Read,1577095993
https://www.theatlantic.com/magazine/archive/2020/01/wheres-my-flying-car/603025/,The Real Trouble With Silicon Valley,,Archive,1576650963
https://capturedeconomy.com/the-wrongs-of-the-wright-brothers/,The Wrongs of the Wright Brothers,,Archive,1576623936
https://www.bryanlehrer.com/entries/costco/,Bryan Lehrer,,Archive,1576615434
https://www.ribbonfarm.com/2017/06/06/thingness-and-thereness/,Thingness and Thereness,,Archive,1576572540
https://www.ribbonfarm.com/2015/09/10/why-nerds-have-bad-taste/,Why Nerds Have Bad Taste,,Archive,1576548995
https://phys.org/news/2019-10-private-property-productivity-precipitated-neolithic.html,"Private property, not productivity, precipitated Neolithic agricultural revolution",,Archive,1576537744
https://americanaffairsjournal.org/2019/11/the-characterless-opportunism-of-the-managerial-class/,The Characterless Opportunism of the Managerial Class - American Affairs Journal,,Archive,1576535590
http://www.paulgraham.com/kids.html,Having Kids,Having Kids https://ift.tt/34l00Qf,To Read,1576404673
http://www.collaborativefund.com/blog/overcoming-your-demons/,Overcoming Your Demons,,Archive,1576257816
https://www.nytimes.com/2019/12/07/opinion/sunday/finland-socialism-capitalism.html,Opinion | Finland Is a Capitalist Paradise,,Archive,1575863996
http://paulgraham.com/lesson.html,The Lesson to Unlearn,,Archive,1575735410
http://www.paulgraham.com/lesson.html,The Lesson to Unlearn,The Lesson to Unlearn https://ift.tt/36dhGPi,To Read,1575722417
https://80000hours.org/2019/11/anonymous-answers-risk-aversion/,Anonymous answers: How risk-averse should talented young people be about their careers?,,Archive,1575562980
https://medium.com/the-year-of-the-looking-glass/in-search-of-perfect-moments-5192329cf7ac,In Search of Perfect Moments,In Search of Perfect Moments https://ift.tt/380Y2rv,A year of the looking glass,1575493098
https://americanaffairsjournal.org/2019/11/the-real-class-war/,The Real Class War - American Affairs Journal,,Archive,1575491846
https://www.nytimes.com/2019/11/29/style/the-clout.html,Here’s What’s Happening in the American Teenage Bedroom,,Archive,1575313882
https://medium.com/swlh/finding-genius-keith-rabois-founders-fund-d0a69b1f9e95,"Finding Genius: Keith Rabois, Founders Fund",,Archive,1575313872
https://en.wikipedia.org/wiki/Education_in_Switzerland,Education in Switzerland - Wikipedia,,Archive,1575218303
https://en.wikipedia.org/wiki/Cantons_of_Switzerland,Cantons of Switzerland - Wikipedia,,Archive,1575218171
https://en.wikipedia.org/wiki/Politics_of_Switzerland,Politics of Switzerland - Wikipedia,,Archive,1575218121
https://www.cato.org/publications/commentary/switzerland-country-works,"Switzerland, a Country That Works",,Archive,1575217379
https://en.wikipedia.org/wiki/Economy_of_Switzerland,Economy of Switzerland - Wikipedia,,Archive,1575217362
https://en.wikipedia.org/wiki/Demographics_of_Switzerland,Demographics of Switzerland - Wikipedia,,Archive,1575217328
https://en.wikipedia.org/wiki/Semi-direct_democracy,Semi-direct democracy - Wikipedia,,Archive,1575217029
https://en.wikipedia.org/wiki/Science_and_technology_in_Switzerland,Science and technology in Switzerland - Wikipedia,,Archive,1575217009
https://en.wikipedia.org/wiki/Taxation_in_Switzerland,Taxation in Switzerland - Wikipedia,,Archive,1575216905
https://www.nomoretax.eu/living/relocation-to-switzerland/,living in Switzerland,,Archive,1575216897
https://en.wikipedia.org/wiki/Subdivisions_of_Switzerland,Subdivisions of Switzerland - Wikipedia,,Archive,1575216753
https://en.wikipedia.org/wiki/Swiss_franc,Swiss franc - Wikipedia,,Archive,1575216444
https://en.wikipedia.org/wiki/Switzerland%E2%80%93European_Union_relations,Switzerland–European Union relations - Wikipedia,,Archive,1575216432
https://en.wikipedia.org/wiki/Switzerland_during_the_World_Wars,Switzerland during the World Wars - Wikipedia,,Archive,1575216422
https://en.wikipedia.org/wiki/Swiss_nationality_law,Swiss nationality law - Wikipedia,,Archive,1575216370
https://en.wikipedia.org/wiki/Human_rights_in_Switzerland,Human rights in Switzerland - Wikipedia,,Archive,1575216273
https://www.benkuhn.net/lux,Your room can be as bright as the outdoors,,Archive,1575216127
https://danieljmitchell.wordpress.com/2016/06/23/congressman-nadler-wins-prize-for-historical-and-constitutional-illiteracy/,Congressman Nadler Wins Prize for Historical and Constitutional Illiteracy,,Archive,1575215919
https://danieljmitchell.wordpress.com/2013/11/04/iceland-switzerland-and-the-golden-rule-of-fiscal-policy/,"Iceland, Switzerland, and the Golden Rule of Fiscal Policy",,Archive,1575215879
https://en.wikipedia.org/wiki/Switzerland_as_a_federal_state,Switzerland as a federal state - Wikipedia,,Archive,1575215695
https://www.atlasnetwork.org/news/article/learning-from-switzerlands-decentralized-model,Learning from Switzerland’s decentralized model,,Archive,1575215678
https://fee.org/articles/the-secret-of-swiss-success-is-decentralization/,The Secret of Swiss Success Is Decentralization,,Archive,1575215665
http://business.time.com/2013/07/26/why-is-insider-trading-even-illegal/,Why Is Insider Trading Even Illegal? | TIME.com,,Archive,1574996588
https://www.bloomberg.com/opinion/articles/2019-11-26/starbucks-chick-fil-a-drop-out-of-america-s-culture-wars,Starbucks and Chick-fil-A Drop Out of the Culture Wars,,Archive,1574798066
https://www.nytimes.com/2019/11/26/style/narrative-violation-venture-capital-tech.html,What Makes a ‘Narrative Violation’?,,Archive,1574794442
https://www.ips-journal.eu/regions/global/article/show/antifragile-states-and-global-cities-3879/,Antifragile states and global cities,,Archive,1574794413
http://www.paulgraham.com/nov.html,Novelty and Heresy,Novelty and Heresy https://ift.tt/2Dd512h,To Read,1574684767
https://www.nationalreview.com/magazine/2019/05/20/sweden-is-capitalist/,Sweden Is Capitalist | National Review,,Archive,1574541406
https://palladiummag.com/2019/11/21/mariana-mazzucato-has-reinvigorated-the-most-important-battle-in-economics/,Mariana Mazzucato Has Reinvigorated The Most Important Battle In...,,Archive,1574534050
http://paulgraham.com/genius.html,The Bus Ticket Theory of Genius,,Archive,1574532982
http://www.paulgraham.com/genius.html,The Bus Ticket Theory of Genius,The Bus Ticket Theory of Genius https://ift.tt/37vhb4z,To Read,1574517548
https://maplemaypole.com/storytelling/,"Storytelling. - Maple, Maypole",,Archive,1574398812
https://bleedingheartlibertarians.com/2012/04/progress-or-poverty-the-economics-of-land-and-discovery/,Progress or Poverty: The Economics of Land and Discovery - Bleeding Heart Libertarians,,Archive,1574371427
https://slatestarcodex.com/2014/03/17/what-universal-human-experiences-are-you-missing-without-realizing-it/,What Universal Human Experiences Are You Missing Without Realizing It?,,Archive,1574293308
https://palladiummag.com/2019/11/13/facebooks-libra-is-half-a-century-late-and-a-navy-short/,Facebook’s Libra Is Half A Century Late And A Navy Short,"Facebook’s Libra Is Half A Century Late And A Navy Short
Facebook's global payment system, Libra, would usurp the role of the dollar, but without the hegemonic military, historical moment, or political utility necessary to make that viable.
palladiummag.com",Archive,1573766666
https://www.epsilontheory.com/why-ben-sasse-loses-the-game-of-you/,Why Ben Sasse Loses the Game of You | Epsilon Theory,https://epsilontheory.com/why-ben-sasse-loses-the-game-of-you/,Archive,1573744907
https://nypost.com/2019/11/09/why-my-college-pals-went-to-yale-while-my-high-school-friends-went-to-jail/,Why my college pals went to Yale while my high school friends went to jail,,Archive,1573688824
https://medium.com/@russroberts/i-cant-hear-you-e7a218831f07,The Outrage Epidemic,,Archive,1573571157
https://www.wired.com/story/empathy-is-tearing-us-apart/,Empathy Is Tearing Us Apart,,Archive,1573404851
https://medium.com/@joulee/achieving-work-life-balance-a22c822bb79b,Achieving Work-Life Balance,Achieving Work-Life Balance https://ift.tt/36OtLeD,A year of the looking glass,1573233446
https://www.bloomberg.com/opinion/articles/2019-11-07/-ok-boomer-phrase-says-more-about-the-kids-than-about-us-boomers,OK Kids. This Boomer Has Had Enough.,,Archive,1573149917
https://www.washingtonpost.com/national-security/former-twitter-employees-charged-with-spying-for-saudi-arabia-by-digging-into-the-accounts-of-kingdom-critics/2019/11/06/2e9593da-00a0-11ea-8bab-0fc209e065a8_story.html,Former Twitter employees charged with spying for Saudi Arabia by digging into the accounts of kingdom critics,,Archive,1573133671
https://blog.cloudflare.com/the-project-jengo-saga-how-cloudflare-stood-up-to-a-patent-troll-and-won/,The Project Jengo Saga: How Cloudflare Stood up to a Patent Troll – and Won!,,Archive,1573131469
https://www.niskanencenter.org/hayek-republican-freedom-and-the-universal-basic-income/,"Hayek, Republican Freedom, and the Universal Basic Income - Niskanen Center",,Archive,1573075467
https://www.linkedin.com/pulse/world-has-gone-mad-system-broken-ray-dalio,The World Has Gone Mad and the System Is Broken,,Archive,1572994293
https://stratechery.com/2019/tech-and-liberty/,Tech and Liberty,,Unread,1572972295
https://www.aier.org/article/how-kids-create-wealth-by-trading-halloween-candy/,How Kids Create Wealth By Trading Halloween Candy,,Archive,1572926049
https://www.niskanencenter.org/explaining-white-nationalisms-anti-statist-bedfellows/,Explaining White Nationalism's Anti-statist Bedfellows - Niskanen Center,,Archive,1572925957
https://danieljmitchell.wordpress.com/2015/05/26/amazing-admission-from-new-york-times-columnist-on-how-feminist-economic-policies-hurt-women/,Amazing Admission from New York Times Columnist on How Feminist Economic Policies Hurt Women,,Archive,1572823551
https://caseyhandmer.wordpress.com/2019/11/02/starlink-is-a-very-big-deal/,Starlink is a very big deal,,Unread,1572823407
https://americanmind.org/essays/americas-delusional-elite-is-done/,America’s Delusional Elite Is Done,,Archive,1572817455
https://www.wsj.com/articles/arnold-schwarzenegger-on-why-jealousy-is-a-good-thing-11572461211,Arnold Schwarzenegger on Why Jealousy Is a Good Thing,,Archive,1572813461
https://www.nytimes.com/2019/11/02/opinion/sunday/switzerland-capitalism-wealth.html,"Opinion | The Happy, Healthy Capitalists of Switzerland",,Archive,1572810920
https://elaineou.com/2016/03/13/keynesian-savings-time/,Keynesian Savings Time,,Archive,1572755295
https://write.as/harold-lee/servants-without-masters,Servants Without Masters,,Archive,1572739983
https://knightcolumbia.org/content/protocols-not-platforms-a-technological-approach-to-free-speech,"Protocols, Not Platforms: A Technological Approach to Free Speech",,Archive,1576084526
http://timharford.com/2016/04/delusions-of-objectivity/,Delusions of objectivity,,Archive,1572737611
https://www.wsj.com/articles/the-rising-threat-of-digital-nationalism-11572620577,The Rising Threat of Digital Nationalism,,Unread,1572737269
https://www.wsj.com/articles/the-making-of-the-worlds-greatest-investor-11572667202,The Making of the World’s Greatest Investor,,Archive,1572713243
https://osf.io/4wk63/,YouTube Politics,,Archive,1572550244
https://randomcriticalanalysis.com/2018/11/19/why-everything-you-know-about-healthcare-is-wrong-in-one-million-charts-a-response-to-noah-smith/,Why everything you have said about the determinants of health expenditure is wrong in one million charts: a response to Noah Smith.,,Archive,1572546101
https://garybasin.com/the-best-bank-may-be-no-bank-at-all/,The best bank may be no bank at all,,Archive,1572545114
http://www.paulgraham.com/addiction.html,The Acceleration of Addictiveness,,Archive,1572531996
https://medium.com/@byrnehobart/what-ren%C3%A9-girard-can-teach-us-about-bubbles-e442a2a58544,What René Girard Can Teach Us About Bubbles,,Archive,1572458925
https://www.ben-evans.com/benedictevans/2019/9/6/face-recognition,Face recognition and the ethics of AI — Benedict Evans,,Archive,1572304155
https://www.crossfit.com/health/the-harmful-myth-about-the-chemical-imbalance-causing-psychiatric-disorders,The Harmful Myth About the Chemical Imbalance Causing Psychiatric Disorders,,Archive,1572024554
https://stratechery.com/2019/the-internet-and-the-third-estate/,The Internet and the Third Estate,,Archive,1571785506
https://meltingasphalt.com/ads-dont-work-that-way/,Ads Don’t Work That Way | Melting Asphalt,,Archive,1571670269
https://www.nytimes.com/2019/10/17/opinion/tech-monopoly-democracy-journalism.html,Opinion | Tech Companies Are Destroying Democracy and the Free Press,,Archive,1571423856
https://www.facebook.com/notes/mark-zuckerberg/standing-for-voice-and-free-expression/10157267502546634/,Standing for Voice and Free Expression | Facebook,,Archive,1571343755
https://taibbi.substack.com/p/were-in-a-permanent-coup,We're in a permanent coup,,Archive,1571017000
https://outline.com/WBeYRT,Outline - Read & annotate without distractions,,Archive,1570929889
https://slatestarcodex.com/2018/10/30/sort-by-controversial/,Sort By Controversial,,Archive,1570541816
https://medium.com/the-year-of-the-looking-glass/the-curse-of-perfect-eb7bfeb52d2e,The Curse of Perfect,The Curse of Perfect https://ift.tt/2nPLHnG,A year of the looking glass,1570031266
https://www.bloomberg.com/opinion/articles/2019-10-01/china-s-70th-anniversary-celebration-is-bittersweet,China Needs to Be More Chinese,,Archive,1569995373
https://www.nytimes.com/2019/09/14/opinion/tech-backlash.html,Opinion | There Is No Tech Backlash,,Archive,1569962413
https://avc.com/2019/09/the-great-public-market-reckoning/,The Great Public Market Reckoning – AVC,,Archive,1569863698
https://www.theatlantic.com/ideas/archive/2019/09/europes-young-not-so-woke/598783/,Europe’s Young People Are Not That Woke,,Archive,1569852838
http://social.techcrunch.com/2016/09/08/snackable-audio/,AirPods and the rise of snackable audio – TechCrunch,,Archive,1569780191
https://www.washingtonpost.com/archive/opinions/1994/11/27/will-success-spoil-america/4c79c031-47b0-40a5-804c-dc8f2080ecdf/,WILL SUCCESS SPOIL AMERICA?,,Archive,1569542111
https://www.wired.com/story/no-data-is-not-the-new-oil/,"No, Data Is Not the New Oil",,Archive,1569377504
https://areomagazine.com/2019/07/31/towards-a-free-and-open-internet/,Towards a Free and Open Internet - Areo,,Archive,1568924656
https://palladiummag.com/2019/05/17/how-cryptocurrency-will-transform-migration/,How Cryptocurrency Will Transform Migration,,Archive,1568879899
https://medium.com/@yelmandjraark/bitcoin-and-competitive-market-dynamics-6c02da32e4bf,Bitcoin: Winner Takes Most or Winner Takes All?,"Bitcoin: Winner Takes Most or Winner Takes All?
Exploring market share capture in cryptocurrencies.
medium.com",Archive,1568757791
http://www.paulgraham.com/growth.html,Startup = Growth,,Archive,1568598560
https://www.theatlantic.com/education/archive/2017/07/internalizing-the-myth-of-meritocracy/535035/,What Happens When Poor Kids Are Taught Society Is Fair,,Archive,1568595670
https://www.ribbonfarm.com/2011/12/08/acting-dead-trading-up-and-leaving-the-middle-class/,"Acting Dead, Trading Up and Leaving the Middle Class",,Archive,1568567081
https://blog.codinghorror.com/the-rise-of-the-electric-scooter/,The Rise of the Electric Scooter,,Archive,1568489597
https://www.theatlantic.com/magazine/archive/2019/10/when-the-culture-war-comes-for-the-kids/596668/,When the Culture War Comes for the Kids,"When the Culture War Comes for the Kids
Caught between a brutal meritocracy and a radical new progressivism, a parent tries to do right by his children while navigating New York City’s schools.
theatlantic.com",Archive,1568402659
https://medium.com/the-year-of-the-looking-glass/coffee-chat-series-1-getting-ahead-as-an-early-career-designer-12d0c0aaec67,Coffee Chat Series #1 Getting Ahead as an Early-Career Designer,Coffee Chat Series #1: Getting Ahead as an Early-Career Designer https://ift.tt/32AlN63,A year of the looking glass,1568218946
http://nymag.com/news/features/27840/,The Power (and Peril) of Praising Your Kids -- New York Magazine - Nymag,,Archive,1568169763
https://medium.com/paradigma-capital/pax-bitcoiniana-5f54eda1a9f9,🗺 Pax Bitcoiniana: After The Last Country on Earth,,Archive,1568034941
https://www.theatlantic.com/technology/archive/2017/04/the-tragedy-of-google-books/523320/,Torching the Modern-Day Library of Alexandria,,Archive,1567997872
https://medium.com/@nic__carter/a-most-peaceful-revolution-8b63b64c203e,A most peaceful revolution,"A most peaceful revolution
Bitcoin is a slow-burning but potent nonviolent rebellion.
medium.com",Archive,1567890949
https://stratechery.com/2019/what-is-a-tech-company/,What Is a Tech Company?,,Unread,1567600726
https://www.nytimes.com/2019/08/26/style/can-plants-talk.html,Do Plants Have Something to Say? - The New York Times,,Archive,1567297448
https://prestonbyrne.com/2016/01/06/uk-us-comparison/,A comparison of American and English Civil Liberties,"Sure thing. Let’s take what could be a fun Saturday night in America, and, putting Scotland and Northern Ireland to one side for now as these are separate jurisdictions, see how many English crimes we can commit by doing what, for a wholesome, well-adjusted, baseball-and-apple-pie American, would be completely normal, healthy, and legal activities:",Archive,1567295939
https://www.economist.com/business/2019/08/31/shopify-and-the-return-of-the-merchant-class,Shopify and the return of the merchant class,,Archive,1567294457
https://mondaynote.com/apple-card-what-vs-how-a6072f2684cd,Apple Card: What vs How,,Archive,1566923017
https://mapandterritory.org/crony-beliefs-78c138991104,Crony Beliefs,,Archive,1566849020
https://blog.p2pfoundation.net/successfull-examples-of-land-value-tax-reforms/2011/02/05,Successfull examples of land value tax reforms | P2P Foundation,,Archive,1566842429
https://stratechery.com/2019/the-wework-ipo/,The WeWork IPO,,Archive,1566313613
https://kwokchain.com/2019/08/16/the-arc-of-collaboration/,The Arc of Collaboration,,Archive,1566281190
https://www.nytimes.com/2015/07/19/t-magazine/sea-ranch-california-utopia.html,"Utopia Rules at Sea Ranch, a Community Born of ’60s Idealism",,Archive,1566239661
http://unenumerated.blogspot.com/2007/08/exit-and-freedom.html,Exit and freedom,,Archive,1566179113
http://distributedweb.care/posts/who-owns-the-stars/,Who Owns the Stars: The Trouble with Urbit,,Archive,1566179075
https://www.quantamagazine.org/new-turmoil-over-predicting-the-effects-of-genes-20190423/,New Turmoil Over Predicting the Effects of Genes | Quanta Magazine,,Archive,1566172937
https://palladiummag.com/2019/08/05/the-real-problem-at-yale-is-not-free-speech/,The Real Problem At Yale Is Not Free Speech,,Archive,1566065909
http://paulgraham.com/aord.html,Default Alive or Default Dead?,,Archive,1565980900
https://avc.com/2019/08/tumblr-2/,Tumblr – AVC,https://avc.com/2019/08/tumblr-2/,Archive,1565905497
