URL,Title,Selection,Folder,Timestamp
http://abovethecrowd.com/2011/03/24/freight-train-that-is-android/,The Freight Train That Is Android | Above the Crowd,,Archive,1525917491
https://www.hodinkee.com/magazine/jony-ive-apple,"Apple, Influence, and Ive",,Unread,1525905856
https://news.greylock.com/why-onboarding-is-the-most-crucial-part-of-your-growth-strategy-8f9ad3ec8d5e,Why Onboarding is the Most Crucial Part of Your Growth Strategy,,Archive,1525827672
https://avc.com/2018/05/is-buying-crypto-assets-investing/,Is Buying Crypto Assets “Investing” – AVC,,Archive,1525627024
https://www.newyorker.com/culture/culture-desk/the-united-states-of-japan,The United States of Japan,,Unread,1525535616
http://blog.eladgil.com/2018/05/core-cryptocurrency-use-cases.html,Core Cryptocurrency Use Cases,,Unread,1525274482
https://medium.com/@LarrySukernik/sovereign-grade-and-platform-grade-censorship-resistance-c1fb7b6b492a,Sovereign-grade and Platform-grade Censorship Resistance,,Archive,1525227381
https://www.washingtonpost.com/business/economy/how-merchants-secretly-use-facebook-to-flood-amazon-with-fake-reviews/2018/04/23/5dad1e30-4392-11e8-8569-26fda6b404c7_story.html,How merchants use Facebook to flood Amazon with fake reviews,,Unread,1524580108
https://www.wired.com/story/augmented-reality-art-museums/,Augmented Reality Is Transforming Museums,,Archive,1524515943
https://www.economist.com/node/387138,Trust and antitrust,,Archive,1524450259
http://blog.eladgil.com/2018/04/sell-your-startup-to-breakout-company.html,Sell Your Startup To A Breakout Company,,Archive,1524255038
https://www.racked.com/2018/4/17/17219166/fashion-style-algorithm-amazon-echo-look,Have Algorithms Destroyed Personal Taste?,,Unread,1524255025
https://a16z.com/2017/02/18/12-things-about-product-market-fit/,12 Things about Product-Market Fit,,Archive,1523454622
https://www.subtraction.com/2018/04/02/in-defense-of-design-thinking-which-is-terrible/,"In Defense of Design Thinking, Which Is Terrible",,Archive,1522777723
https://www.nytimes.com/2016/05/29/books/review/sebastian-jungers-tribe.html,Sebastian Junger’s ‘Tribe’,,Archive,1522717946
https://journal.thriveglobal.com/how-technology-hijacks-peoples-minds-from-a-magician-and-google-s-design-ethicist-56d62ef5edf3,How Technology is Hijacking Your Mind — from a Former Insider,,Archive,1522609672
https://www.axios.com/is-silicon-valley-over-1521999028-af9032d9-0eea-4432-847e-2f117753e63b.html,Is Silicon Valley over?,,Archive,1522063728
https://www.nytimes.com/2018/03/21/technology/facebook-zucktown-willow-village.html,Welcome to Zucktown. Where Everything Is Just Zucky.,,Archive,1521656508
https://www.nytimes.com/2018/03/20/technology/founders-for-change-tech-diversity.html,"Hundreds of Start-Ups Tell Investors: Diversify, or Keep Your Money",,Archive,1521604801
https://www.wired.com/story/sociologists-examine-hackathons-and-see-exploitation/,Sociologists Examine Hackathons and See Exploitation,,Archive,1521594767
https://sf.curbed.com/2018/3/19/17138290/peter-thiel-slumlords-comments-speech-rent-sf-silicon,"Peter Thiel gripes about San Francisco rents, ‘slumlords’ in Silicon Valley",,Archive,1521501114
https://www.theverge.com/2018/3/15/17039010/amazon-kindle-oasis-2017-vs-real-paper-books-versus-lauren-goode,In defense of real books,,Archive,1521303905
https://www.ben-evans.com/benedictevans/2017/5/24/not-even-wrong-ways-to-dismiss-technology,Not even wrong - ways to dismiss technology,,Unread,1520969702
https://www.wired.com/story/the-decentralized-internet-is-here-with-some-glitches,"The Decentralized Internet Is Here, With Some Glitches",,Archive,1520826247
https://mosaicscience.com/story/staying-awake-surprisingly-effective-way-treat-depression,Staying awake: the surprisingly effective way to treat depression,,Archive,1520715478
https://www.scientificamerican.com/article/the-neuroscience-of-beauty/,The Neuroscience of Beauty,,Archive,1520633959
https://medium.com/@vkhosla/is-majoring-in-liberal-arts-a-mistake-for-students-bc10bc8bacbd,Is Majoring in Liberal Arts a Mistake for Students?,,Unread,1520626137
https://stratechery.com/2018/lessons-from-spotify/,Lessons from Spotify,,Archive,1520435354
http://avc.com/2018/03/pay-attention-to-the-package/,Pay Attention To The Package – AVC,,Archive,1520186551
https://www.fastcompany.com/40525495/social-capitals-chamath-palihapc2aditiya-wants-to-fix-capitalism,Social Capital’s Chamath Palihap­itiya Wants To Fix Capitalism,,Archive,1519946460
https://www.wsj.com/articles/how-does-the-worlds-biggest-tech-investor-make-its-bets-unpredictably-1519661008,How Does the World’s Biggest Tech Investor Make Its Bets? Unpredictably,"Attention founders: SoftBank’s Masa Son decided in 30 minutes he wanted to invest in a startup that grows vegetables indoors—$200 million, twice what the startup asked for. 

Nobody can quite figure out the man running a $92 billion tech fund.
¯\_(ツ)_/¯

https://t.co/GeMB8D5PaV",Archive,1519669552
https://www.nytimes.com/2018/02/20/magazine/the-case-against-google.html,The Case Against Google,,Archive,1527705372
https://www.nytimes.com/2018/02/21/opinion/boys-violence-shootings-guns.html,Opinion | The Boys Are Not All Right,"Been saying this privately for awhile and doing my best to live it, glad to see it stated so explicitly: Men are desperately in need of help and connection from other men. It's at the root of so many civilization-scale crises. https://t.co/5pRV26LJ90",Archive,1519326109
https://www.wired.com/story/shared-electric-bikes-take-on-everyone/,Electric Bikes Want to Take On Everyone—Even Uber,,Archive,1519313376
https://www.theverge.com/2018/2/21/17035552/sexual-assault-harassment-whisper-network-reporting-failure-marquis-boire,When whisper networks let us down: how communities struggle — and sometimes fail — to stop sexual assault,"For me, the post-Weinstein moment—and its now-growing backlash—coincided with reporting a story that required countless interviews with alleged victims and bystanders close to them. I've been thinking a lot about whisper networks. This is what I learned.   https://t.co/oi3YIXwtBr",Archive,1519244317
https://a16z.com/2018/02/10/crypto-readings-resources/,Crypto Canon,,Archive,1519233743
https://www.theatlantic.com/business/archive/2017/09/sweden-startups/541413/,Why Does Sweden Have So Many Start-Ups?,,Archive,1519232066
http://www.wired.co.uk/article/how-china-became-tech-superpower-took-over-the-west,From imitation to innovation: How China became a tech superpower,,Archive,1519092722
http://www.niemanlab.org/2018/02/facebooks-campbell-brown-this-is-not-about-us-trying-to-make-everybody-happy/,Facebook’s Campbell Brown: “This is not about us trying to make everybody happy”,,Archive,1519092719
http://nautil.us/issue/18/Genius/how-jocks-and-mathletes-are-alike,How Jocks and Mathletes Are Alike - Issue 18: Genius - Nautilus,How Jocks and Mathletes Are Alike,Unread,1519081566
http://nautil.us/issue/38/noise/this-is-your-brain-on-silence-rp,This Is Your Brain on Silence - Issue 38: Noise - Nautilus,,Archive,1519081555
https://uncrunched.com/2018/02/18/the-real-history-of-techcrunch/,The Real History Of TechCrunch,,Unread,1519057433
https://www.theatlantic.com/science/archive/2018/02/the-more-gender-equality-the-fewer-women-in-stem/553592/,"The More Gender Equality, the Fewer Women in STEM",,Archive,1519039489
https://www.wsj.com/articles/like-peter-thiel-others-feel-alienated-by-silicon-valley-groupthink-1518962400,"Like Peter Thiel, Others Feel Alienated by Silicon Valley Groupthink",,Archive,1519039372
https://medium.com/@cdixon/why-decentralization-matters-5e3f79f7638e,Why Decentralization Matters – Chris Dixon – Medium,,Archive,1518972937
https://blog.atrium.co/how-we-raised-10-million-on-just-an-idea-a5a0fb13f6e8,Behind the scenes: How Justin Kan fundraises – blog.atrium.co,,Archive,1518744160
https://www.ft.com/content/b27f84f8-1006-11e8-940e-08320fc2a277,City universities are the new global brands,,Archive,1518712412
https://www.washingtonpost.com/business/economy/why-silicon-valley-singles-are-giving-up-on-the-algorithms-of-love/2018/02/14/6cbd74ee-1041-11e8-8ea1-c1d91fcec3fe_story.html,Why Silicon Valley singles are giving up on the algorithms of love,,Archive,1518706101
https://stratechery.com/2018/twitters-earnings-the-end-of-tellapart-direct-versus-brand-marketing-and-size/,"Twitter’s Earnings; The End of TellApart; Direct Versus Brand Marketing, and Size",,Archive,1518616108
https://www.wired.com/story/everyone-hates-silicon-valley-except-its-imitators/,"Everyone Hates Silicon Valley, Except Its Imitators",,Archive,1518610551
https://www.wired.com/story/inside-facebook-mark-zuckerberg-2-years-of-hell/,Inside Facebook's Two Years of Hell,,Archive,1518569231
https://stratechery.com/2018/shipping-with-amazon-fba-onsite-uber-and-waymo-settle/,"Shipping With Amazon, FBA Onsite, Uber and Waymo Settle",,Archive,1518435124
https://feld.com/archives/2015/04/the-religion-of-silicon-valley.html,The Religion of Silicon Valley - Feld Thoughts,,Archive,1518402281
https://www.nytimes.com/2018/02/10/opinion/sunday/favorite-songs.html,Opinion | The Songs That Bind,,Archive,1518402039
http://avc.com/2018/01/the-co-founder-relationship/,The Co-Founder Relationship – AVC,,Archive,1518376437
http://avc.com/2015/07/the-no-hands-up-syndrome/,The No Hands Syndrome – AVC,,Archive,1518316720
https://www.justinobeirne.com/google-maps-moat/,Google Maps’s Moat,,Archive,1518294636
https://www.theatlantic.com/business/archive/2018/02/whole-foods-two-hour-delivery-amazon/552821/,The Amazon-ification of Whole Foods,,Archive,1518135681
http://blog.ycombinator.com/why-toys/,Why Toys?,,Archive,1518113735
https://www.fedscoop.com/rise-fall-18f/,The rise and fall of 18F - Fedscoop,,Archive,1518107934
https://www.bloomberg.com/news/articles/2018-02-06/inside-airbnb-s-battle-to-stay-private,Inside Airbnb’s Battle to Stay Private,,Archive,1518036198
https://www.nytimes.com/2018/02/07/magazine/teenagers-learning-online-porn-literacy-sex-education.html,What Teenagers Are Learning From Online Porn,"What Teenagers Are Learning From Online Porn: ""American adolescents watch much more pornography than their parents know — and it’s shaping their ideas about pleasure, power and intimacy. Can they be taught to see it more critically?""",Archive,1518028465
https://www.nytimes.com/2018/02/07/technology/funding-local-news-charge-people-money.html,A Crazy Idea for Funding Local News: Charge People for It,,Archive,1518025908
https://www.nytimes.com/2012/05/13/magazine/joe-weisenthal-vs-the-24-hour-news-cycle.html,Joe Weisenthal vs. the 24-Hour News Cycle,Joe Weisenthal vs. the 24-Hour News Cycle - The New York Times,Archive,1518014212
https://stratechery.com/2018/snaps-earnings-fox-signs-deal-for-thursday-nfl-football-the-sports-linchpin-and-snap-et-al/,"Snap’s Earnings, Fox Signs Deal for Thursday NFL Football, The Sports Linchpin and Snap et al.",,Archive,1518005605
https://www.bloomberg.com/news/articles/2018-02-06/tesla-sees-your-super-bowl-ad-and-raises-you-a-rocket-launch,Tesla Sees Your Super Bowl Ad and Raises You a Rocket Launch,,Archive,1518005084
https://www.nytimes.com/2018/02/05/science/mutant-crayfish-clones-europe.html,"This Mutant Crayfish Clones Itself, and It’s Taking Over Europe",,Archive,1517949697
https://www.theatlantic.com/science/archive/2018/02/i-spent-two-years-trying-to-fix-the-gender-imbalance-in-my-stories/552404/,I Spent Two Years Trying to Fix the Gender Imbalance in My Stories,,Archive,1517936345
https://www.washingtonpost.com/lifestyle/food/at-least-on-yelp-diners-prefer-independent-restaurants-over-chains/2018/02/05/4d4597de-0a99-11e8-8b0d-891602206fb7_story.html,"At least on Yelp, diners prefer independent restaurants over chains",,Archive,1517930547
https://www.wsj.com/articles/can-apple-be-equally-successful-in-hardware-and-services-1517745601,"How Apps, Music and More Can Buoy Apple Beyond the iPhone",,Archive,1517927496
https://www.economist.com/news/business/21736193-worlds-biggest-tech-firms-see-opportunity-health-care-which-could-mean-empowered,Apple and Amazon’s moves in health signal a coming transformation,,Archive,1517927137
https://medium.com/startup-grind/infinite-scroll-the-webs-slot-machine-c18c2502d5c1,Infinite Scroll: The Web’s Slot Machine,,Archive,1517925842
https://www.wired.com/story/apple-podcast-analytics-first-month/,Podcast Listeners Really Are the Holy Grail Advertisers Hoped They'd Be,,Archive,1517925833
https://www.ben-evans.com/benedictevans/2018/1/4/smart-homes-and-vegetable-peelers,Smart homes and vegetable peelers,,Archive,1517925718
https://stratechery.com/2018/apple-follow-up-apple-earnings-sony-ceo-kazuo-hirai-steps-down/,"Apple Follow-Up, Apple Earnings, Sony CEO Kazuo Hirai Steps Down",,Archive,1517922549
https://www.bloomberg.com/news/articles/2018-02-05/the-investor-using-venture-capital-and-machine-learning-to-cure-cancer,The Investor Using Venture Capital and Machine Learning to Cure Cancer,,Archive,1517878535
https://www.nytimes.com/2018/02/05/technology/silicon-valley-brotopia-emily-chang.html,How Silicon Valley Came to Be a Land of ‘Bros’,How Silicon Valley Came to Be a Land of ‘Bros’ -- thanks so much @puiwingtam @nytimes for asking important questions! https://t.co/Fcd5lVknrE,Archive,1517849593
https://twitter.com/mims/status/960501277355597824,Twitter,,Archive,1517836430
https://www.wsj.com/articles/apple-music-on-track-to-overtake-spotify-in-u-s-subscribers-1517745720,Apple Music on Track to Overtake Spotify in U.S. Subscribers,,Archive,1517925751
https://www.theatlantic.com/science/archive/2018/01/urban-birds-are-evolving-to-be-fed/551120/,Urban Bird Feeders Are Changing the Course of Evolution,Urban Birds Are Evolving to Be Fed,Archive,1517595837
https://www.bloomberg.com/news/articles/2018-01-31/ikea-fortune-falls-to-no-one-after-billionaire-founder-s-death,What’s Going to Happen to Ikea Founder’s Billions?,"Ikea founder leaves fortune to no one, structures it to ensure it lasts forever",Archive,1517594589
https://www.nytimes.com/2018/02/02/technology/cryptocurrency-puerto-rico.html,Making a Crypto Utopia in Puerto Rico,,Archive,1517587668
https://www.wired.com/1996/02/jobs-2/,Steve Jobs: The Next Insanely Great Thing,,Unread,1571854800
https://www.bloomberg.com/news/articles/2018-02-01/airbnb-cfo-departs-amid-tensions-leaving-ipo-timeline-unclear,"Airbnb CFO Departs Amid Tensions, Leaving IPO Timeline Unclear",,Archive,1517516225
https://stratechery.com/2018/amazon-health/,Amazon Health,,Archive,1517444925
https://twitter.com/donie/status/958778931649200133,Donie O'Sullivan on Twitter,,Archive,1517609796
http://blog.eladgil.com/2018/01/the-case-for-ethereum.html,The Case For Ethereum,,Archive,1517355453
https://www.wired.com/story/dangers-keeping-women-out-of-tech/,The Dangers of Keeping Women Out of Tech,"""If tech companies can’t persuade more women and people of color to major in computer science, they are not going to be able to fill the positions that they have."" https://t.co/nWyCnngvqK",Archive,1517249690
https://www.nytimes.com/2018/01/25/business/media/damien-chazelle-apple.html,Apple Goes Deeper Into La La Land With Damien Chazelle Project,,Archive,1517245853
https://www.reuters.com/article/us-go-jek-fundraising-google/google-says-invests-in-indonesian-ride-hailing-firm-go-jek-idUSKBN1FI0EE,Google confirms investment in Indonesian ride-hailing firm Go-Jek,,Archive,1517245838
https://www.wsj.com/articles/how-amazons-ad-business-could-threaten-google-and-facebook-1517157327,How Amazon’s Ad Business Could Threaten Google and Facebook,,Archive,1517245772
https://digiday.com/media/hes-not-pr-guy-adam-mosseri-facebooks-head-news-feed-become-unlikely-good-guy-publishers/,"'He's not a PR guy': Adam Mosseri, Facebook's head of news feed, has become an unlikely good guy to publishers - Digiday",,Archive,1517245764
https://www.bikebiz.com/news/dockless-booming-in-china,Dockless bike-share leads to quick spike in bike use in Chinese cities,,Archive,1517245747
https://www.wsj.com/articles/what-if-children-should-be-spending-more-time-with-screens-1516539618,What If Children Should Be Spending More Time With Screens?,,Archive,1517160594
https://www.1843magazine.com/content/ideas/robert-lane-greene/which-best-language-learn,Which is the best language to learn?,,Archive,1516964078
https://www.nytimes.com/2018/01/25/opinion/artificial-intelligence-black-box.html,Opinion | Artificial Intelligence’s ‘Black Box’ Is Nothing to Fear,"Human intelligence is the original black box -- so AI is actually *more* transparent, not less. Profound piece by @vijaypande https://t.co/B4TqCDMx4a",Archive,1516904250
https://www.bloomberg.com/news/articles/2018-01-25/ripple-wants-xrp-to-be-bitcoin-for-banks-if-only-the-banks-wanted-it,Ripple Wants XRP to Be Bitcoin for Banks,,Archive,1516897874
https://www.1843magazine.com/culture/the-daily/meet-the-vegans-having-better-sex-than-you,Meet the vegans having better sex than you,How veganism got macho https://t.co/GJWAq1SITl From @1843mag https://t.co/txCUSUJsLd,Archive,1516889017
https://www.vanityfair.com/news/2018/01/mark-zuckerberg-facebook-downward-spiral,“This Is Serious”: Facebook Begins Its Downward Spiral,,Archive,1516831157
https://www.ben-evans.com/benedictevans/2017/10/27/fashion-maslow-and-facebooks-control-of-social,"Fashion, Maslow and Facebook's control of social",,Archive,1516830121
http://variety.com/2018/biz/features/roku-tv-streaming-1202658579/,How Roku Morphed From a Quirky Hardware Startup to a TV Streaming Powerhouse,,Archive,1516830107
https://www.thedailybeast.com/this-is-the-data-snapchat-doesnt-want-you-to-see,This Is the Data Snapchat Doesn’t Want You to See,,Archive,1516830098
http://www.latimes.com/business/technology/la-fi-tn-evan-spiegel-bobby-murphy-20170302-story.html,Exclusive interview: How Snapchat founder Evan Spiegel feels after the historic IPO,,Archive,1516829984
https://www.nytimes.com/2018/01/24/technology/Apple-iPhone-medical-records.html,"Apple, in Sign of Health Ambitions, Adds Medical Records Feature for iPhone","Apple, in Sign of Health Ambitions, Adds Medical Records Feature for iPhone",Archive,1516818457
https://www.scientificamerican.com/article/the-neuroscience-of-changing-your-mind/,The Neuroscience of Changing Your Mind,,Archive,1516818446
http://nyti.ms/2E743o0,About That Joint: Marijuana Start-Ups Pass,"In the booming legal marijuana industry, the joint has gone out of favor. Now everyone is vaping cannabis, changing the perception and ubiquity of the drug, @fmanjoo writes. https://t.co/EwfMitVtMg",Archive,1516818333
https://www.economist.com/news/britain/21732123-drug-has-become-more-plentifuland-more-potent-britains-cocaine-glut,Britain’s cocaine glut,,Archive,1516715644
https://www.wired.com/2016/09/marc-andreessens-book-collection-explains-silicon-valley/,Silicon Valley’s Secrets Are Hiding in Marc Andreessen’s Library,,Archive,1516713531
https://www.economist.com/blogs/graphicdetail/2018/01/daily-chart-14,Crypto-currencies are in a tailspin,,Archive,1516658739
https://www.wired.com/story/margit-wennmachers-is-andreessen-horowitzs-secret-weapon/,"The Spin Master Behind Facebook, Airbnb, and Silicon Valley As You Know It",,Archive,1516656686
https://ia.net/topics/is-time-money/,Is Time Money? – iA,,Archive,1516439544
https://logicmag.io/03-dont-be-evil/,Don't Be Evil,,Archive,1516325190
https://medium.com/@ia/money-quality-and-time-2914cbe4636e,"Money, Quality and Time – iA Inc. – Medium",,Archive,1516228791
http://www.nytimes.com/1982/06/03/garden/issue-and-debate-should-video-games-be-restricted-by-law.html,ISSUE AND DEBATE; SHOULD VIDEO GAMES BE RESTRICTED BY LAW?,,Archive,1516224304
https://stratechery.com/2018/facebooks-motivations/,Facebook’s Motivations,"Facebook's Motivations

https://t.co/SDDIzsp0jj

The impact of Facebook's News Feed changes on the media is far less interesting than what the changes — and their stated purpose — say about Facebook itself.",Archive,1516214030
https://www.nytimes.com/2018/01/17/technology/apple-addiction-iphone.html,It’s Time for Apple to Build a Less-Addictive iPhone,"It’s Time for Apple to Build a Less Addictive iPhone.

It’s not Apple’s fault that you feel enslaved by your phone. But Apple can do more to address this problem than just about anyone else. 

My @nytimes column

https://t.co/yy7YSyod5s",Starred,1516214006
https://www.vox.com/science-and-health/2018/1/15/16863374/willpower-overrated-self-control-psychology,Why willpower is overrated,"Willpower is kind of a myth -- build your life around good habits instead. Also, it helps to be wealthy. https://t.co/iSf2s3xqSP",Archive,1516213766
http://www.asymco.com/2018/01/08/the-ios-economy-updated/,"The iOS Economy, Updated",,Archive,1516172557
https://www.nytimes.com/2018/01/06/opinion/looming-digital-meltdown.html,Opinion | The Looming Digital Meltdown,,Archive,1516164590
https://www.economist.com/news/technology-quarterly/21733193-how-obstacles-workable-brain-computer-interfaces-may-be-overcome-search,In search of serendipity,,Archive,1516164590
https://www.wired.com/story/outlier-tech-clothes/,"Softwear: How Outlier, the Underground Fashion Label for Nerds, Got Cool",,Archive,1516164586
https://medium.com/initialized-capital/taking-care-of-your-health-while-running-a-startup-c85ccb66edc,Taking Care of Your Health While Running A Startup – Initialized Capital – Medium,,Archive,1516164581
http://avc.com/2018/01/some-thoughts-on-equity-compensation/,Some Thoughts On Equity Compensation – AVC,,Archive,1516164563
https://www.wired.com/story/free-speech-issue-tech-turmoil-new-censorship/,It's the (Democracy-Poisoning) Golden Age of Free Speech,,Archive,1516164569
https://www.newyorker.com/magazine/2018/01/15/improving-ourselves-to-death,Improving Ourselves to Death,,Archive,1515778630
https://www.economist.com/news/finance-and-economics/21734462-which-could-be-next-digital-coin-rule-them-all-bitcoin-no-long-only,Bitcoin is no long the only game in crypto-currency town,,Archive,1515698752
https://www.economist.com/news/technology-quarterly/21733192-once-data-have-been-extracted-brain-how-can-they-be-employed-best,Turning brain signals into useful information,,Archive,1515657114
https://www.nytimes.com/2012/01/22/business/apple-america-and-a-squeezed-middle-class.html,"Apple, America and a Squeezed Middle Class",,Archive,1515639618
http://slatestarcodex.com/2016/04/28/why-were-early-psychedelicists-so-weird/,Why Were Early Psychedelicists So Weird?,,Archive,1515446669
http://www.theguardian.com/technology/2017/nov/12/jaron-lanier-book-dawn-new-everything-interview-virtual-reality,Jaron Lanier: ‘The solution is to double down on being human’,,Archive,1515446502
https://www.theglobeandmail.com/technology/your-smartphone-is-making-you-stupid/article37511900/,"Your smartphone is making you stupid, antisocial and unhealthy. So why can’t you put it down?",,Archive,1515446259
https://www.thecut.com/2018/01/ask-polly-why-am-i-so-lazy.html,Ask Polly: ‘Why Am I So Lazy?’,,Archive,1515311896
https://www.rollingstone.com/music/news/beatles-revolver-how-lsd-opened-the-door-to-a-masterpiece-w436062,Beatles' Acid Test: How LSD Opened the Door to 'Revolver',,Archive,1515204829
https://medium.com/@m0nologuer/the-gigabore-a-decade-of-cultural-blandness-4fa66e94aab1,The GIGABORE: A decade of cultural blandness,,Archive,1515194794
https://www.vanityfair.com/news/2018/01/brotopia-silicon-valley-secretive-orgiastic-inner-sanctum,"“Oh My God, This Is So F---ed Up”: Inside Silicon Valley’s Dark Side",,Archive,1514934873
https://www.jnd.org/dn.mss/then_and_now_the_ba.html,Then and Now: The Bauhaus and 21st century design - jnd.org,,Archive,1514269361
http://shapeof.com/archives/2017/12/bloomberg_single_ui_experience.html,Thoughts on Gurman's Report of a Single UI Experience Across iOS and MacOS,,Archive,1514140683
http://www.nytimes.com/1984/07/10/science/about-education-harsh-charges-against-computers.html,ABOUT EDUCATION; HARSH CHARGES AGAINST COMPUTERS,,Archive,1514068369
http://blog.samaltman.com/a-clarification,A Clarification,A Clarification http://ift.tt/2CGlDxM,To Read,1513451745
https://eand.co/the-dopamine-economy-336b239272ef,The Dopamine Economy – Eudaimonia and Co,,Archive,1513356803
https://medium.com/the-year-of-the-looking-glass/many-ways-to-learn-fead05124d0e,Many ways to learn,Many ways to learn http://ift.tt/2AtCrXh,A year of the looking glass,1513326492
https://www.wired.com/story/future-of-augmented-reality-2018/,The Race for AR Glasses Starts Now | Backchannel,"In secret labs around the world, techies are hard at work inventing a wave of computing that will literally be in your face. Like it or not, the next field of battle in tech is for your field of vision https://t.co/cK9brEJgaO",Archive,1517336500
http://blog.samaltman.com/e-pur-si-muove,E Pur Si Muove,E Pur Si Muove http://ift.tt/2AXXD99,To Read,1513272246
http://social.techcrunch.com/2017/12/12/sec-shuts-down-munchee-ico/,SEC shuts down Munchee ICO,,Archive,1513105736
https://stratechery.com/2017/disney-and-fox/,Disney and Fox,,Archive,1513091627
http://www.theguardian.com/us-news/2017/oct/06/hermits-solitude-wilderness-new-mexico,This reclusive life: what I learned about solitude from my time with hermits,,Archive,1513040980
http://reprints.longform.org/playboy-interview-steve-jobs,Playboy Interview: Steve Jobs,,Archive,1513040959
http://www.kguttag.com/2016/12/06/magic-leap-when-reality-hits-the-fan/,http://www.kguttag.com/2016/12/06/magic-leap-when-reality-hits-the-fan/,,Archive,1513023332
