URL,Title,Selection,Folder,Timestamp
https://medium.com/the-year-of-the-looking-glass/tending-the-spark-56c266ab588a,Tending the Spark in The Year of the Looking Glass,"""Tending the Spark"" in The Year of the Looking Glass http://ift.tt/1FrSJey",A year of the looking glass,1433261745
http://skillcode.com/keep-meditation-to-yourself/,3 Good Reasons to Keep Meditation to Yourself,,Archive,1433029432
http://www.newyorker.com/magazine/2015/05/18/tomorrows-advance-man,Who Funds the Future?,,Archive,1431907537
https://medium.com/the-year-of-the-looking-glass/the-future-of-design-in-technology-fe1697e5826,The Future of Design in Technology in The Year of the Looking Glass,"""The Future of Design in Technology"" in The Year of the Looking Glass http://ift.tt/1ctyzZH",A year of the looking glass,1431454540
http://www.nytimes.com/2015/03/15/opinion/sunday/frank-bruni-how-to-survive-the-college-admissions-madness.html,How to Survive the College Admissions Madness,,Archive,1431292662
http://daringfireball.net/2015/04/watch_apple_watch,"Watch, Apple Watch",,Archive,1430426502
http://blog.samaltman.com/the-days-are-long-but-the-decades-are-short,The days are long but the decades are short,The days are long but the decades are short http://ift.tt/1DTKDcY,Sam Altman,1430248700
http://www.washingtonpost.com/lifestyle/food/farm-bill-why-dont-taxpayers-subsidize-the-foods-that-are-better-for-us/2014/02/14/d7642a3c-9434-11e3-84e1-27626c5ef5fb_story.html,Farm bill: Why don’t taxpayers subsidize the foods that are better for us?,,Archive,1430170174
http://social.techcrunch.com/2015/04/26/silicon-valley-can-accelerate-social-impact-globally/,Silicon Valley Can Accelerate Social Impact Globally,,Archive,1430090095
http://www.nytimes.com/2015/04/19/magazine/the-muddied-meaning-of-mindfulness.html,The Muddied Meaning of ‘Mindfulness’,,Archive,1430002629
http://blog.manbolo.com/2014/06/30/apple-on-hamburger-menus,Apple on Hamburger Menus,,Archive,1429757445
https://medium.com/@joulee/how-to-impress-an-interviewer-c210d9d8e84a,How to Impress an Interviewer,How to Impress an Interviewer http://ift.tt/1d0mBHG,A year of the looking glass,1429722687
http://www.nytimes.com/2011/11/21/business/media/occupy-wall-street-puts-the-coverage-in-the-spotlight.html,Occupy Wall Street Puts the Coverage in the Spotlight,,Archive,1429596493
http://www.nytimes.com/2013/08/04/education/edlife/lifting-the-veil-on-the-holistic-process-at-the-university-of-california-berkeley.html,"Lifting the Veil on the Holistic Process at the University of California, Berkeley",,Archive,1429506744
http://jamesclear.com/paper-clips,"How to Stick With Good Habits Every Day by Using the ""Paper Clip Strategy"" | James Clear",,Archive,1429493535
http://www.nytimes.com/2015/04/12/opinion/sunday/david-brooks-the-moral-bucket-list.html,The Moral Bucket List,,Archive,1429387114
http://www.amazon.com/Cognition-Practice-Mathematics-Everyday-Learning/dp/0521357349,"Amazon.com: Cognition in Practice: Mind, Mathematics and Culture in Everyday Life (Learning in Doing) (9780521357340): Jean Lave: Books","Cognition in Practice: Mind, Mathematics, and Culture in Everyday Life",Archive,1429302643
http://www.mondaynote.com/2015/04/12/an-apple-watch-meta-review-reimagined/,An Apple Watch Meta-Review Reimagined,,Archive,1428899799
https://recode.net/2015/04/08/a-week-on-the-wrist-the-apple-watch-review/,A Week on the Wrist: The Apple Watch Review,,Archive,1428534125
http://www.nytimes.com/2015/04/09/technology/personaltech/apple-watch-bliss-but-only-after-a-steep-learning-curve.html,"Apple Watch Review: Bliss, but Only After a Steep Learning Curve",,Archive,1428534119
http://daringfireball.net/2015/04/the_apple_watch,The Apple Watch,,Archive,1428534112
http://roadlesstravelled.me/2015/04/06/why-steve-jobs-motivated-me-to-quit-apple/,I Quit: What Really Goes on at Apple,,Archive,1428531828
https://medium.com/@joulee/what-designers-can-learn-from-pms-3aa285f511bc,What Designers can Learn from PMs,What Designers can Learn from PMs http://ift.tt/1EZ0HuH,A year of the looking glass,1427817642
http://www.newyorker.com/magazine/2014/12/01/quiet-german,The Astonishing Rise of Angela Merkel - The New Yorker,,Archive,1427241524
http://www.theguardian.com/commentisfree/2015/mar/23/this-week-i-may-be-jailed-for-writing-a-book-on-human-rights-abuses,This week I may be jailed for writing a book on human rights abuses,,Archive,1427232165
http://blog.samaltman.com/bubble-talk,Bubble talk,Bubble talk http://ift.tt/1BL0BVq,Sam Altman,1427225615
http://www.theatlantic.com/features/archive/2015/03/the-irrationality-of-alcoholics-anonymous/386255/,The Bad Science of Alcoholics Anonymous,,Archive,1426908666
http://www.paulgraham.com/gba.html,"The Word ""Hacker""",,Archive,1426907075
http://www.theverge.com/2015/3/17/8103593/golden-krishna-best-interface-is-no-interface-excerpt,The best interface is no interface: why we don't always need An App for That,,Archive,1426642515
http://www.fastcompany.com/3042433/steve-jobs/the-real-legacy-of-steve-jobs,The Evolution Of Steve Jobs,,Archive,1426639779
http://bits.blogs.nytimes.com/2015/03/15/silicon-valley-investor-says-the-end-is-near/,Silicon Valley Investor Warns of Bubble at SXSW,,Archive,1426535874
http://www.wired.com/2015/03/github-conquered-google-microsoft-everyone-else/,"How GitHub Conquered Google, Microsoft, and Everyone Else | WIRED",,Archive,1426442032
http://www.paulgraham.com/swan.html,Black Swan Farming,,Archive,1426028104
https://medium.com/the-year-of-the-looking-glass/the-idea-person-e08e36f9024d,The Idea Person in The Year of the Looking Glass,"""The Idea Person"" in The Year of the Looking Glass http://ift.tt/1B0H96L",A year of the looking glass,1426003675
http://www.jstor.org/stable/10.1086/668168,"JSTOR: The Quarterly Review of Biology, Vol. 87, No. 4 (December 2012), pp. 289-313",,Archive,1425979437
https://medium.com/inside/when-i-was-a-young-kid-i-d-spend-most-of-my-time-playing-with-lego-3330e059cfd7,"Lego, motorcycles, and building products in Inside Medium","""Lego, motorcycles, and building products"" in Inside Medium http://ift.tt/1FxNR8O",A year of the looking glass,1425869488
http://www.nytimes.com/2015/03/08/upshot/true-reform-in-higher-education-when-online-degrees-are-seen-as-official.html,Here’s What Will Truly Change Higher Education: Online Degrees That Are Seen as Official,,Archive,1425840506
https://chroniclevitae.com/news/929-academia-s-1-percent,Academia’s 1 Percent,,Archive,1425766859
http://nautil.us/issue/22/slow/how-music-hijacks-our-perception-of-time-rp,How Music Hijacks Our Perception of Time - Issue 22: Slow - Nautilus,,Archive,1425684509
http://www.theguardian.com/books/2015/mar/04/neil-gaiman-douglas-adams-writer-genius,Douglas Adams made me a writer: Neil Gaiman salutes his friend and inspiration,,Archive,1425536271
http://www.hopkinsmedicine.org/news/media/releases/treadmill_performance_predicts_mortality,Treadmill Performance Predicts Mortality - 03/02/2015,,Archive,1425454544
http://blog.samaltman.com/technology-predictions,Technology predictions,Technology predictions http://ift.tt/1AW3fvS,Sam Altman,1425406689
http://reactionwheel.net/2015/01/80s-vc.html,Heat Death: Venture Capital in the 1980s,,Archive,1425358636
http://rbth.com/news/2015/02/27/over_73_percent_of_russians_admit_crisis_in_russia_44055.html,Over 73 percent of Russians admit crisis in Russia | Russia Beyond The Headlines,"""The poll was timed to the March 1 rallies and not only to them. Its purpose was to determine people general attitude to the crisis, the opposition, the authorities' actions, etc. The first question we asked people was aimed at determining the degree of people's concern about the situation in the country. It said 'Should the situation in the country be called a crisis, or are these problems temporary?' Three-fourths of the people, 73.3 percent, said they see the situation as a crisis,"" Mironov told a press conference on Thursday.",Archive,1425357919
http://blog.samaltman.com/machine-intelligence-part-2,"Machine intelligence, part 2","Machine intelligence, part 2 http://ift.tt/1EbEhJP",Sam Altman,1425335625
http://rspb.royalsocietypublishing.org/content/282/1802/20142711,Top carnivores increase their kill rates on prey as a response to human-induced fear | Proceedings of the Royal Society of London B: Biological Sciences,,Archive,1425263375
http://www.fastcompany.com/3042861/the-y-combinator-chronicles/the-secret-million-that-y-combinator-invests-in-all-its-startups,The Secret Million That Y Combinator Invests In All Its Startups,,Archive,1425020361
http://hn.premii.com/,Hacker News,,Archive,1426711855
http://www.paulgraham.com/altair.html,What Microsoft Is this the Altair Basic of,What Microsoft Is this the Altair Basic of? http://ift.tt/1DZ1xwb,Paul Graham,1424945941
https://www.schneier.com/essays/archives/2014/02/its_time_to_break_up.html,Schneier on Security: It's Time to Break Up the NSA,,Archive,1424890484
http://blog.samaltman.com/machine-intelligence-part-1,"Machine intelligence, part 1","Machine intelligence, part 1 http://ift.tt/1DVqHvD",Sam Altman,1424888331
https://www.readability.com/articles/9gjpirqg,Two Brains Running,,Archive,1424881682
http://nymag.com/daily/intelligencer/2015/02/jeff-wise-mh370-theory.html,How Crazy Am I to Think I Actually Know Where That Malaysia Airlines Plane Is?,,Archive,1424825131
http://nymag.com/daily/intelligencer/2015/01/anti-vaccinators-react-to-measles-outbreak.html,What Anti-Vaccinators Are Saying Online About the Disneyland Measles Outbreak,"As the Disneyland measles outbreak swells - the number of cases in the U.S. has ticked up to 102 infections in 14 states, most of which link back to the the iconic theme park - the anti-vaccination community has been having a crisis dialogue within its own ranks.",Archive,1424754512
https://hbr.org/2015/02/what-millennials-want-from-work-charted-across-the-world,"What Millennials Want from Work, Charted Across the World",,Archive,1424741645
http://www.fastcodesign.com/3042014/how-designers-built-the-world-of-the-grand-budapest-hotel-by-hand,"How Designers Built The World Of ""The Grand Budapest Hotel"" By Hand",,Archive,1424733430
http://www.economist.com/news/business/21618816-instead-romanticising-entrepreneurs-people-should-understand-how-hard-their-lives-can,Entrepreneurs anonymous,,Archive,1424475422
http://blog.samaltman.com/startup-advice-briefly,"Startup advice, briefly","Startup advice, briefly http://ift.tt/1FDuTRb",Sam Altman,1424458154
http://www.stopsmilingonline.com/story_detail.php?id=760,Just the Facts: David Fincher's Zodiac :: Stop Smiling Magazine,,Archive,1424306385
http://www.newyorker.com/magazine/2015/02/23/shape-things-come,Jonathan Ive and the Future of Apple - The New Yorker,,Archive,1424233906
https://medium.com/the-year-of-the-looking-glass/all-the-things-that-dont-matter-fde892d49743,All the Things that Don’t Matter in The Year of the Looking Glass,"""All the Things that Don’t Matter"" in The Year of the Looking Glass http://ift.tt/1El5jfZ",A year of the looking glass,1424192454
http://blog.samaltman.com/the-software-revolution,The Software Revolution,The Software Revolution http://ift.tt/19oyYLR,Sam Altman,1424108039
http://www.nytimes.com/2015/02/15/jobs/the-tyranny-of-the-forced-smile.html,The Tyranny of the Forced Smile,,Archive,1424048176
http://www.newyorker.com/magazine/2015/02/02/pursuit-beauty,Solving an Unsolvable Math Problem - The New Yorker,,Archive,1423890144
http://www.nytimes.com/2015/02/15/magazine/the-stanford-undergraduate-and-the-mentor.html,The Stanford Undergraduate and the Mentor,,Archive,1423719901
http://blog.samaltman.com/china,China,China http://ift.tt/1AYBcx1,Sam Altman,1423680915
http://blog.samaltman.com/farmlogs,FarmLogs,FarmLogs http://ift.tt/1MaFDIl,Sam Altman,1423607921
http://www.buzzfeed.com/bplanten/when-children-with-autism-grow-up,When Children With Autism Grow Up,,Archive,1423448778
http://casnocha.com/reid-hoffman-lessons,"10,000 Hours with Reid Hoffman: What I Learned",,Archive,1423433145
http://www.thebookoflife.org/the-great-philosophers-karl-marx/,Karl Marx,,Archive,1423403512
http://www.jamesmaa.com/2012/12/02/james-maas-productivity-hacking-guide/,James Maa's Productivity Hacking Guide - James Maa,,Archive,1423339637
https://snfi.org/invitational/schedule,Tentative Schedule : Stanford Speech & Debate Tournament,,Archive,1423339637
https://medium.com/@jkumahara/last-days-at-teehan-lax-3fa5b481107b,Our Last Few Days at Teehan+Lax,Our Last Few Days at Teehan+Lax http://ift.tt/1yRoEW0,A year of the looking glass,1423062098
http://www.wisdomination.com/screw-motivation-what-you-need-is-discipline/,"Screw motivation, what you need is discipline.",,Archive,1422826527
http://www.newyorker.com/magazine/2011/05/16/creation-myth,Creation Myth - The New Yorker,,Archive,1422747619
http://nymag.com/daily/intelligencer/2015/01/53-historians-on-obamas-legacy.html,53 Historians Weigh In on Barack Obama’s Legacy,,Archive,1422575123
http://priceonomics.com/why-every-movie-looks-sort-of-orange-and-blue/,Why Every Movie Looks Sort of Orange and Blue,,Archive,1422548561
https://medium.com/the-year-of-the-looking-glass/the-imposter-syndrome-9e23e2326d88,The Imposter Syndrome in The Year of the Looking Glass,"""The Imposter Syndrome"" in The Year of the Looking Glass http://ift.tt/1DdpHz4",A year of the looking glass,1422377245
http://www.technologyreview.com/news/533596/smart-software-can-be-tricked-into-seeing-what-isnt-there/,Optical Illusions That Fool Google-Style Image Recognition Algorithms | MIT Technology Review,,Archive,1419415409
http://www.nytimes.com/interactive/2014/12/22/upshot/what-2000-calories-looks-like.html,"What 2,000 Calories Looks Like",,Archive,1419365620
http://www.theguardian.com/commentisfree/2012/may/18/anti-intellectualism-us-book-banning,Anti-intellectualism is taking over the US,,Archive,1419306053
http://www.quora.com/How-can-I-have-more-meaningful-conversations-with-people-in-todays-world,How can I have more meaningful conversations with people in today's world? - Quora,Hacks to have more meaningful conversations with people: http://t.co/fiLH9hPPam,Archive,1419186524
https://twitter.com/Quora/status/546428648652550144,Quora on Twitter,Childfree couples share what life is like without kids: http://t.co/CmfbhIw1nB,Archive,1419186521
https://medium.com/inside/there-will-be-money-d80f7d0178a9,There Will Be Money,,Archive,1419186400
https://medium.com/war-is-boring/heres-how-the-military-wasted-your-money-in-afghanistan-b392e3e84e5a,Here’s How the Military Wasted Your Money in Afghanistan,,Archive,1418152838
http://www.technologyreview.com/featuredstory/531726/technology-and-inequality/,Technology and Inequality,,Archive,1417989918
http://www.nytimes.com/2014/12/04/opinion/nicholas-kristof-abusing-chickens-we-eat.html,Abusing Chickens We Eat,,Archive,1417765604
http://www.quora.com/What-are-some-of-the-biggest-red-flags-in-an-interview,What are some of the biggest red flags in an interview? - Quora,Hiring managers chime in on the red flags they see in interviews: http://t.co/BETaBINIqo,Archive,1417473135
http://www.fastcodesign.com/3024987/slicker-city/can-silicon-valley-be-saved,Can Silicon Valley Be Saved?,Can Silicon Valley be saved? http://t.co/A5d2YS4b4e #longreads http://t.co/UvthFqIWUt,Archive,1417472976
http://www.sfgate.com/business/networth/article/How-and-why-buyers-from-China-are-snatching-up-5924991.php,How and why buyers from China are snatching up Bay Area homes,How and why buyers from China are snatching up Bay Area homes http://t.co/gZqpLkTpJW,Archive,1417472947
http://www.independent.co.uk/news/science/scientists-predict-green-energy-revolution-after-incredible-new-graphene-discoveries-9885425.html,Scientists predict green energy revolution after incredible new graphene discoveries,Graphene: Scientists predict green energy revolution after incredible new graphene discoveries http://t.co/cI9JWYIux8 @Nasser_Saidi,Archive,1417387754
http://jamesclear.com/physics-productivity,The Physics of Productivity,Applying Newton's three laws of motion to the concept of productivity. Great stuff -- The Physics of Productivity http://t.co/YgAqPq5XHP,Archive,1417327056
http://www.fastcodesign.com/3032975/exposure/intimate-photos-of-how-people-eat-in-new-york-city,Intimate Photos Of How People Eat In New York City,,Archive,1417326986
https://medium.com/behavior-design/the-psychology-of-a-billion-dollar-enterprise-app-why-is-slack-so-habit-forming-691669e7bdaa,The Psychology of a Billion-Dollar Enterprise App: Why Is Slack So Habit-Forming?,“The Psychology of a Billion-Dollar Enterprise App: Why Is Slack So Habit-Forming?” by @nireyal https://t.co/x26ugdzDYa,Archive,1417325615
http://www.femalefounderstories.com/reham-fagiri.html?utm_campaign=buffer&utm_content=bufferc11a7&utm_medium=social&utm_source=twitter.com,Reham Fagiri - AptDeco - YC Female Founder Stories,"""When more girls aspire to be engineers there will be more women tech entrepreneurs."" - Reham Fagiri, @AptDeco http://t.co/n1JkjX37RS",Archive,1417325581
http://notch.net/2014/09/im-leaving-mojang/,I’m leaving Mojang | notch.net,,Archive,1417325558
http://www.economist.com/news/books-and-arts/21634989-strange-roots-american-icon-bird-not-plane,"A bird, but not a plane","“Not even girls want to be girls, so long as our feminine archetype lacks strength and power"" http://t.co/7Zuu2sNLxI http://t.co/JRTgxIX3JU",Archive,1417324763
http://www.economist.com/blogs/democracyinamerica/2014/11/jobs-young-southerners,Thanks for nothing,"In an average group of 100 14-15 year-old Americans, 27 will not finish high school on time http://t.co/S1ixTQqYVP http://t.co/OlUlk6EzyR",Archive,1417324691
http://www.nytimes.com/2014/11/27/upshot/calories-on-menus-a-nationwide-experiment-into-human-behavior.html,Calories on Menus: Nationwide Experiment Into Human Behavior,,Archive,1417324644
https://lnkd.in/dmkmWYm,Harvard Unveils MRI Study Proving Meditation Literally Rebuilds The Brain's Gray Matter In 8 Weeks,,Archive,1417324622
http://www.businessinsider.com/iphone-6-plus-versus-iphone-6-2014-11,"Yes, You Should Get The iPhone 6 Plus Instead Of The iPhone 6",,Archive,1417324612
http://www.theguardian.com/lifeandstyle/2014/nov/29/letter-to-girl-accused-me-of-rape,A letter to … the girl who accused me of rape when I was 15,,Archive,1417286758
http://paulgraham.com/mean.html,Mean People Fail,Mean People Fail: http://t.co/OKZOGIQu3U,Archive,1417277722
http://online.wsj.com/articles/energy-world-quakes-as-opec-stands-pat-1417209813,1w0Pn1W,,Archive,1417277509
http://www.economist.com/blogs/freeexchange/2014/11/americas-economy,How strong is it?,,Archive,1417277481
http://fortune.com/2014/11/22/bitcoin-hackathon/,Up all night with NYU's bitcoin hackers,,Archive,1417238562
http://www.fastcodesign.com/3034005/asides/the-unspoken-rules-of-favela-design,The Unspoken Rules Of Favela Design,,Archive,1417238562
http://arstechnica.com/tech-policy/2014/11/kim-dotcom-im-officially-broke-after-transferring-remaining-assets/,Kim Dotcom: “I’m officially broke” after transferring remaining assets,,Archive,1417222211
http://techcrunch.com/2014/11/28/preparing-for-an-acquisition/,Preparing For An Acquisition,,Archive,1417222194
http://www.economist.com/news/science-and-technology/21635235-idea-commonwealth-strong-scientific-body-something-common,Something in common,,Archive,1417221664
http://www.politico.com/magazine/story/2014/08/what-i-did-after-police-killed-my-son-110038.html,What I Did After Police Killed My Son,,Archive,1416729268
http://pando.com/2014/10/06/venture-capital-and-the-great-big-silicon-valley-asshole-game/,Venture capital and the great big Silicon Valley asshole game | PandoDaily,,Archive,1416520580
http://moreintelligentlife.com/story/david-foster-wallace-in-his-own-words,"DAVID FOSTER WALLACE, IN HIS OWN WORDS",,Archive,1416113973
http://time.com/3475962/asian-american-diversity/,The Real Problem When It Comes to Diversity and Asian-Americans,,Archive,1415766717
https://medium.com/message/ebola-the-real-reason-everyone-should-panic-889f32740e3e,Ebola: The Real Reason Everyone Should Panic,“Ebola: The Real Reason Everyone Should Panic” —@zeynep https://t.co/2HA78nzvbw,Archive,1414786752
http://www.washingtonpost.com/blogs/answer-sheet/wp/2014/10/24/teacher-spends-two-days-as-a-student-and-is-shocked-at-what-she-learned/,Teacher spends two days as a student and is shocked at what she learns,,Archive,1414715380
http://www.theguardian.com/lifeandstyle/2009/may/15/buddhist-retreat-religion-first-person,'I spent 12 years in a cave',,Archive,1414707913
http://www.nytimes.com/2014/10/22/us/rule-change-lets-los-angeles-dream-of-spires-and-sky-high-gardens.html,Rule Change Lets Los Angeles Dream of Spires,"""Rule Change Lets Los Angeles Dream of Spires"" by ADAM NAGOURNEY via NYT U.S. http://ift.tt/1wsYuXM",Archive,1413950182
http://parenting.blogs.nytimes.com/2014/10/20/there-are-more-important-things-than-saving-for-college/,There Are More Important Things Than Saving for College,"""There Are More Important Things Than Saving for College"" by MEADOW RUE MERRILL via NYT U.S. http://ift.tt/1x0K27i",Archive,1413950181
http://www.nytimes.com/2014/10/22/us/a-holder-legacy-shifting-terror-cases-to-the-courts-and-winning.html,"A Holder Legacy Shifting Terror Cases to the Courts, and Winning","""A Holder Legacy: Shifting Terror Cases to the Courts, and Winning"" by MATT APUZZO via NYT U.S. http://ift.tt/1vIkHkn",Archive,1413933761
http://www.nytimes.com/2014/10/21/us/speaker-of-alabama-house-is-arrested-on-corruption-charges.html,Speaker of Alabama House Is Arrested on Corruption Charges,"""Speaker of Alabama House Is Arrested on Corruption Charges"" by ALAN BLINDER via NYT U.S. http://ift.tt/1CNAoag",Archive,1413929986
http://www.nytimes.com/2014/10/22/us/ebola-west-africa-united-states-flights.html,U.S. to Route Passengers From Ebola-Hit Nations to 5 Airports,"""U.S. to Route Passengers From Ebola-Hit Nations to 5 Airports"" by MATT APUZZO via NYT U.S. http://ift.tt/1wig2EZ",Archive,1413919063
http://www.nytimes.com/2014/10/22/us/politics/environmental-issues-become-a-force-in-political-advertising.html,Environmental Issues Become a Force in Political Advertising,"""Environmental Issues Become a Force in Political Advertising"" by CORAL DAVENPORT and ASHLEY PARKER via NYT U.S. http://ift.tt/1tIE3Ho",Archive,1413915320
http://www.nytimes.com/interactive/2014/10/20/us/cascade-of-contacts-from-ebola-case.html,A Cascade of Contacts From a Single Case of Ebola in Dallas,"""A Cascade of Contacts From a Single Case of Ebola in Dallas"" by HAEYOUN PARK via NYT U.S. http://ift.tt/1uzu2Xq",Archive,1413912208
http://www.nytimes.com/interactive/2014/10/15/us/changes-to-ebola-protection-worn-by-us-hospital-workers.html,Changes to Ebola Protection Worn by U.S. Hospital Workers,"""Changes to Ebola Protection Worn by U.S. Hospital Workers"" by  via NYT U.S. http://ift.tt/1rw3xA1",Archive,1413908917
http://www.nytimes.com/2014/10/21/us/latest-news-oscar-pistorius-oscar-de-la-renta-hong-kong-talks.html,Your Tuesday Briefing,"""Your Tuesday Briefing"" by VICTORIA SHANNON via NYT U.S. http://ift.tt/1sJVL9V",Archive,1413904559
http://www.nytimes.com/2014/10/22/us/ali-mazrui-scholar-of-africa-who-divided-us-audiences-dies-at-81.html,"Ali Mazrui, Scholar of Africa Who Divided U.S. Audiences, Dies at 81","""Ali Mazrui, Scholar of Africa Who Divided U.S. Audiences, Dies at 81"" by DOUGLAS MARTIN via NYT U.S. http://ift.tt/1CO1qhx",Archive,1413901961
http://www.nytimes.com/2014/10/21/us/on-ebola-response-congressional-republicans-put-new-focus-on-visa-suspensions.html,"On Ebola Response, Congressional Republicans Put New Focus on Visa Suspensions","""On Ebola Response, Congressional Republicans Put New Focus on Visa Suspensions "" by JONATHAN WEISMAN via NYT U.S. http://ift.tt/1ycNX24",Archive,1413899399
http://www.nytimes.com/2014/10/21/us/in-raising-immigration-gop-risks-blowback-after-election.html,"In Raising Immigration, G.O.P. Risks Backlash After Election","""In Raising Immigration, G.O.P. Risks Backlash After Election"" by JEREMY W. PETERS via NYT U.S. http://ift.tt/1tGn4FK",Archive,1413898257
http://www.nytimes.com/2014/10/21/us/new-counts-for-suspect-in-abduction-in-virginia.html,New Counts for Suspect in Abduction of University of Virginia Student,"""New Counts for Suspect in Abduction of University of Virginia Student"" by JENNIFER STEINHAUER via NYT U.S. http://ift.tt/1DuaSZT",Archive,1413898256
http://www.nytimes.com/2014/10/21/us/rabbinical-council-to-add-a-role-for-women-in-wake-of-voyeurism-scandal.html,Voyeur Case Spurs Rabbis to Add Post for Women,"""Voyeur Case Spurs Rabbis to Add Post for Women"" by MICHAEL PAULSON via NYT U.S. http://ift.tt/1CMmIMA",Archive,1413891331
http://www.nytimes.com/2014/10/21/us/politics/iowa-senate-election.html?nytmobile=0,"With Farms Fading and Urban Might Rising, Power Shifts in Iowa - NYTimes.com",,Archive,1413874468
http://www.nytimes.com/2014/10/21/us/politics/iowa-senate-election.html,"With Farms Fading and Urban Might Rising, Power Shifts in Iowa","""With Farms Fading and Urban Might Rising, Power Shifts in Iowa"" by MICHAEL BARBARO via NYT U.S. http://ift.tt/1zitTzA",Archive,1413874172
http://www.nytimes.com/2014/10/21/us/cdc-issues-new-guidelines-for-ebola-care.html,C.D.C. Issues New Guidelines for Ebola Care,"""C.D.C. Issues New Guidelines for Ebola Care"" by DONALD G. McNEIL Jr. via NYT U.S. http://ift.tt/1yTnnOT",Archive,1413867208
https://medium.com/@jerometave/designing-switch-co-from-idea-to-launched-product-ce4c395742ae,Designing Switch.co: From Idea to Launched Product,,Archive,1413858919
